{
  "address": "0x4f42048C40671b98be16176C9D020D03F30A2Dc4",
  "abi": [
    {
      "inputs": [
        {
          "internalType": "address",
          "name": "_router",
          "type": "address"
        },
        {
          "internalType": "address",
          "name": "_link",
          "type": "address"
        }
      ],
      "stateMutability": "nonpayable",
      "type": "constructor"
    },
    {
      "inputs": [
        {
          "internalType": "uint64",
          "name": "destinationChainSelector",
          "type": "uint64"
        }
      ],
      "name": "DestinationChainNotAllowed",
      "type": "error"
    },
    {
      "inputs": [
        {
          "internalType": "address",
          "name": "owner",
          "type": "address"
        },
        {
          "internalType": "address",
          "name": "target",
          "type": "address"
        },
        {
          "internalType": "uint256",
          "name": "value",
          "type": "uint256"
        }
      ],
      "name": "FailedToWithdrawEth",
      "type": "error"
    },
    {
      "inputs": [
        {
          "internalType": "address",
          "name": "router",
          "type": "address"
        }
      ],
      "name": "InvalidRouter",
      "type": "error"
    },
    {
      "inputs": [
        {
          "internalType": "uint256",
          "name": "currentBalance",
          "type": "uint256"
        },
        {
          "internalType": "uint256",
          "name": "calculatedFees",
          "type": "uint256"
        }
      ],
      "name": "NotEnoughBalance",
      "type": "error"
    },
    {
      "inputs": [],
      "name": "NothingToWithdraw",
      "type": "error"
    },
    {
      "inputs": [
        {
          "internalType": "address",
          "name": "sender",
          "type": "address"
        }
      ],
      "name": "SenderNotAllowed",
      "type": "error"
    },
    {
      "inputs": [
        {
          "internalType": "uint64",
          "name": "sourceChainSelector",
          "type": "uint64"
        }
      ],
      "name": "SourceChainNotAllowed",
      "type": "error"
    },
    {
      "anonymous": false,
      "inputs": [
        {
          "indexed": true,
          "internalType": "bytes32",
          "name": "messageId",
          "type": "bytes32"
        },
        {
          "indexed": true,
          "internalType": "uint64",
          "name": "sourceChainSelector",
          "type": "uint64"
        },
        {
          "indexed": false,
          "internalType": "address",
          "name": "sender",
          "type": "address"
        },
        {
          "indexed": false,
          "internalType": "string",
          "name": "text",
          "type": "string"
        },
        {
          "indexed": false,
          "internalType": "address",
          "name": "token",
          "type": "address"
        },
        {
          "indexed": false,
          "internalType": "uint256",
          "name": "tokenAmount",
          "type": "uint256"
        }
      ],
      "name": "MessageReceived",
      "type": "event"
    },
    {
      "anonymous": false,
      "inputs": [
        {
          "indexed": true,
          "internalType": "bytes32",
          "name": "messageId",
          "type": "bytes32"
        },
        {
          "indexed": true,
          "internalType": "uint64",
          "name": "destinationChainSelector",
          "type": "uint64"
        },
        {
          "indexed": false,
          "internalType": "address",
          "name": "receiver",
          "type": "address"
        },
        {
          "indexed": false,
          "internalType": "string",
          "name": "text",
          "type": "string"
        },
        {
          "indexed": false,
          "internalType": "address",
          "name": "token",
          "type": "address"
        },
        {
          "indexed": false,
          "internalType": "uint256",
          "name": "tokenAmount",
          "type": "uint256"
        },
        {
          "indexed": false,
          "internalType": "address",
          "name": "feeToken",
          "type": "address"
        },
        {
          "indexed": false,
          "internalType": "uint256",
          "name": "fees",
          "type": "uint256"
        }
      ],
      "name": "MessageSent",
      "type": "event"
    },
    {
      "anonymous": false,
      "inputs": [
        {
          "indexed": true,
          "internalType": "address",
          "name": "from",
          "type": "address"
        },
        {
          "indexed": true,
          "internalType": "address",
          "name": "to",
          "type": "address"
        }
      ],
      "name": "OwnershipTransferRequested",
      "type": "event"
    },
    {
      "anonymous": false,
      "inputs": [
        {
          "indexed": true,
          "internalType": "address",
          "name": "from",
          "type": "address"
        },
        {
          "indexed": true,
          "internalType": "address",
          "name": "to",
          "type": "address"
        }
      ],
      "name": "OwnershipTransferred",
      "type": "event"
    },
    {
      "inputs": [],
      "name": "acceptOwnership",
      "outputs": [],
      "stateMutability": "nonpayable",
      "type": "function"
    },
    {
      "inputs": [
        {
          "internalType": "uint64",
          "name": "_destinationChainSelector",
          "type": "uint64"
        },
        {
          "internalType": "bool",
          "name": "allowed",
          "type": "bool"
        }
      ],
      "name": "allowlistDestinationChain",
      "outputs": [],
      "stateMutability": "nonpayable",
      "type": "function"
    },
    {
      "inputs": [
        {
          "internalType": "address",
          "name": "_sender",
          "type": "address"
        },
        {
          "internalType": "bool",
          "name": "allowed",
          "type": "bool"
        }
      ],
      "name": "allowlistSender",
      "outputs": [],
      "stateMutability": "nonpayable",
      "type": "function"
    },
    {
      "inputs": [
        {
          "internalType": "uint64",
          "name": "_sourceChainSelector",
          "type": "uint64"
        },
        {
          "internalType": "bool",
          "name": "allowed",
          "type": "bool"
        }
      ],
      "name": "allowlistSourceChain",
      "outputs": [],
      "stateMutability": "nonpayable",
      "type": "function"
    },
    {
      "inputs": [
        {
          "internalType": "uint64",
          "name": "",
          "type": "uint64"
        }
      ],
      "name": "allowlistedDestinationChains",
      "outputs": [
        {
          "internalType": "bool",
          "name": "",
          "type": "bool"
        }
      ],
      "stateMutability": "view",
      "type": "function"
    },
    {
      "inputs": [
        {
          "internalType": "address",
          "name": "",
          "type": "address"
        }
      ],
      "name": "allowlistedSenders",
      "outputs": [
        {
          "internalType": "bool",
          "name": "",
          "type": "bool"
        }
      ],
      "stateMutability": "view",
      "type": "function"
    },
    {
      "inputs": [
        {
          "internalType": "uint64",
          "name": "",
          "type": "uint64"
        }
      ],
      "name": "allowlistedSourceChains",
      "outputs": [
        {
          "internalType": "bool",
          "name": "",
          "type": "bool"
        }
      ],
      "stateMutability": "view",
      "type": "function"
    },
    {
      "inputs": [
        {
          "components": [
            {
              "internalType": "bytes32",
              "name": "messageId",
              "type": "bytes32"
            },
            {
              "internalType": "uint64",
              "name": "sourceChainSelector",
              "type": "uint64"
            },
            {
              "internalType": "bytes",
              "name": "sender",
              "type": "bytes"
            },
            {
              "internalType": "bytes",
              "name": "data",
              "type": "bytes"
            },
            {
              "components": [
                {
                  "internalType": "address",
                  "name": "token",
                  "type": "address"
                },
                {
                  "internalType": "uint256",
                  "name": "amount",
                  "type": "uint256"
                }
              ],
              "internalType": "struct Client.EVMTokenAmount[]",
              "name": "destTokenAmounts",
              "type": "tuple[]"
            }
          ],
          "internalType": "struct Client.Any2EVMMessage",
          "name": "message",
          "type": "tuple"
        }
      ],
      "name": "ccipReceive",
      "outputs": [],
      "stateMutability": "nonpayable",
      "type": "function"
    },
    {
      "inputs": [],
      "name": "getLastReceivedMessageDetails",
      "outputs": [
        {
          "internalType": "bytes32",
          "name": "messageId",
          "type": "bytes32"
        },
        {
          "internalType": "string",
          "name": "text",
          "type": "string"
        },
        {
          "internalType": "address",
          "name": "tokenAddress",
          "type": "address"
        },
        {
          "internalType": "uint256",
          "name": "tokenAmount",
          "type": "uint256"
        }
      ],
      "stateMutability": "view",
      "type": "function"
    },
    {
      "inputs": [],
      "name": "getRouter",
      "outputs": [
        {
          "internalType": "address",
          "name": "",
          "type": "address"
        }
      ],
      "stateMutability": "view",
      "type": "function"
    },
    {
      "inputs": [],
      "name": "owner",
      "outputs": [
        {
          "internalType": "address",
          "name": "",
          "type": "address"
        }
      ],
      "stateMutability": "view",
      "type": "function"
    },
    {
      "inputs": [
        {
          "internalType": "uint64",
          "name": "_destinationChainSelector",
          "type": "uint64"
        },
        {
          "internalType": "address",
          "name": "_receiver",
          "type": "address"
        },
        {
          "internalType": "string",
          "name": "_text",
          "type": "string"
        },
        {
          "internalType": "address",
          "name": "_token",
          "type": "address"
        },
        {
          "internalType": "uint256",
          "name": "_amount",
          "type": "uint256"
        }
      ],
      "name": "sendMessagePayLINK",
      "outputs": [
        {
          "internalType": "bytes32",
          "name": "messageId",
          "type": "bytes32"
        }
      ],
      "stateMutability": "nonpayable",
      "type": "function"
    },
    {
      "inputs": [
        {
          "internalType": "uint64",
          "name": "_destinationChainSelector",
          "type": "uint64"
        },
        {
          "internalType": "address",
          "name": "_receiver",
          "type": "address"
        },
        {
          "internalType": "string",
          "name": "_text",
          "type": "string"
        },
        {
          "internalType": "address",
          "name": "_token",
          "type": "address"
        },
        {
          "internalType": "uint256",
          "name": "_amount",
          "type": "uint256"
        }
      ],
      "name": "sendMessagePayNative",
      "outputs": [
        {
          "internalType": "bytes32",
          "name": "messageId",
          "type": "bytes32"
        }
      ],
      "stateMutability": "nonpayable",
      "type": "function"
    },
    {
      "inputs": [
        {
          "internalType": "bytes4",
          "name": "interfaceId",
          "type": "bytes4"
        }
      ],
      "name": "supportsInterface",
      "outputs": [
        {
          "internalType": "bool",
          "name": "",
          "type": "bool"
        }
      ],
      "stateMutability": "pure",
      "type": "function"
    },
    {
      "inputs": [
        {
          "internalType": "address",
          "name": "to",
          "type": "address"
        }
      ],
      "name": "transferOwnership",
      "outputs": [],
      "stateMutability": "nonpayable",
      "type": "function"
    },
    {
      "inputs": [
        {
          "internalType": "address",
          "name": "_beneficiary",
          "type": "address"
        }
      ],
      "name": "withdraw",
      "outputs": [],
      "stateMutability": "nonpayable",
      "type": "function"
    },
    {
      "inputs": [
        {
          "internalType": "address",
          "name": "_beneficiary",
          "type": "address"
        },
        {
          "internalType": "address",
          "name": "_token",
          "type": "address"
        }
      ],
      "name": "withdrawToken",
      "outputs": [],
      "stateMutability": "nonpayable",
      "type": "function"
    },
    {
      "stateMutability": "payable",
      "type": "receive"
    }
  ],
  "transactionHash": "0x6cc887d443d994d7993d90cdfb01ddb96b1dd56cf03d804d9089e26314055c3f",
  "receipt": {
    "to": null,
    "from": "0x4803003e06Fe7Bc150cC8CB21D12750A1A1bA135",
    "contractAddress": "0x4f42048C40671b98be16176C9D020D03F30A2Dc4",
    "transactionIndex": 1,
    "gasUsed": "1677268",
    "logsBloom": "0x00000000000000000000000000000000000000000000000000000000020000000000000002000000000000000000000000008000000000000000000000000000000000000000000000000000000000800000000000000000000100000000000000000000000000000000000000000000000000000000000080000000000000000000000000000000000000000000000000000000000000000000000000000000200000000000000000000000000000000000000000000000000108000000004000000000000000000001000000000000000000000000000000100000000040000000000000000080000000000000000000000000000000000000000000100000",
    "blockHash": "0x3593a706e8d4f3744067d46a26f16466fd8e5821498c1d6128d1554cc1f3fb7e",
    "transactionHash": "0x6cc887d443d994d7993d90cdfb01ddb96b1dd56cf03d804d9089e26314055c3f",
    "logs": [
      {
        "transactionIndex": 1,
        "blockNumber": 42443067,
        "transactionHash": "0x6cc887d443d994d7993d90cdfb01ddb96b1dd56cf03d804d9089e26314055c3f",
        "address": "0x0000000000000000000000000000000000001010",
        "topics": [
          "0x4dfe1bbbcf077ddc3e01291eea2d5c70c2b422b415d95645b9adcfd678cb1d63",
          "0x0000000000000000000000000000000000000000000000000000000000001010",
          "0x0000000000000000000000004803003e06fe7bc150cc8cb21d12750a1a1ba135",
          "0x0000000000000000000000005082f249cdb2f2c1ee035e4f423c46ea2dab3ab1"
        ],
        "data": "0x0000000000000000000000000000000000000000000000000008f03314ffec00000000000000000000000000000000000000000000000000027bbd7c6bb8f84300000000000000000000000000000000000000000000039b5a98505dbb99e03d0000000000000000000000000000000000000000000000000272cd4956b90c4300000000000000000000000000000000000000000000039b5aa14090d099cc3d",
        "logIndex": 5,
        "blockHash": "0x3593a706e8d4f3744067d46a26f16466fd8e5821498c1d6128d1554cc1f3fb7e"
      }
    ],
    "blockNumber": 42443067,
    "cumulativeGasUsed": "1817549",
    "status": 1,
    "byzantium": true
  },
  "args": [
    "0x70499c328e1E2a3c41108bd3730F6670a44595D1",
    "0x326C977E6efc84E512bB9C30f76E30c160eD06FB"
  ],
  "numDeployments": 2,
  "solcInputHash": "777523d546d30d8adc78b0eafd0eebc1",
  "metadata": "{\"compiler\":{\"version\":\"0.8.19+commit.7dd6d404\"},\"language\":\"Solidity\",\"output\":{\"abi\":[{\"inputs\":[{\"internalType\":\"address\",\"name\":\"_router\",\"type\":\"address\"},{\"internalType\":\"address\",\"name\":\"_link\",\"type\":\"address\"}],\"stateMutability\":\"nonpayable\",\"type\":\"constructor\"},{\"inputs\":[{\"internalType\":\"uint64\",\"name\":\"destinationChainSelector\",\"type\":\"uint64\"}],\"name\":\"DestinationChainNotAllowed\",\"type\":\"error\"},{\"inputs\":[{\"internalType\":\"address\",\"name\":\"owner\",\"type\":\"address\"},{\"internalType\":\"address\",\"name\":\"target\",\"type\":\"address\"},{\"internalType\":\"uint256\",\"name\":\"value\",\"type\":\"uint256\"}],\"name\":\"FailedToWithdrawEth\",\"type\":\"error\"},{\"inputs\":[{\"internalType\":\"address\",\"name\":\"router\",\"type\":\"address\"}],\"name\":\"InvalidRouter\",\"type\":\"error\"},{\"inputs\":[{\"internalType\":\"uint256\",\"name\":\"currentBalance\",\"type\":\"uint256\"},{\"internalType\":\"uint256\",\"name\":\"calculatedFees\",\"type\":\"uint256\"}],\"name\":\"NotEnoughBalance\",\"type\":\"error\"},{\"inputs\":[],\"name\":\"NothingToWithdraw\",\"type\":\"error\"},{\"inputs\":[{\"internalType\":\"address\",\"name\":\"sender\",\"type\":\"address\"}],\"name\":\"SenderNotAllowed\",\"type\":\"error\"},{\"inputs\":[{\"internalType\":\"uint64\",\"name\":\"sourceChainSelector\",\"type\":\"uint64\"}],\"name\":\"SourceChainNotAllowed\",\"type\":\"error\"},{\"anonymous\":false,\"inputs\":[{\"indexed\":true,\"internalType\":\"bytes32\",\"name\":\"messageId\",\"type\":\"bytes32\"},{\"indexed\":true,\"internalType\":\"uint64\",\"name\":\"sourceChainSelector\",\"type\":\"uint64\"},{\"indexed\":false,\"internalType\":\"address\",\"name\":\"sender\",\"type\":\"address\"},{\"indexed\":false,\"internalType\":\"string\",\"name\":\"text\",\"type\":\"string\"},{\"indexed\":false,\"internalType\":\"address\",\"name\":\"token\",\"type\":\"address\"},{\"indexed\":false,\"internalType\":\"uint256\",\"name\":\"tokenAmount\",\"type\":\"uint256\"}],\"name\":\"MessageReceived\",\"type\":\"event\"},{\"anonymous\":false,\"inputs\":[{\"indexed\":true,\"internalType\":\"bytes32\",\"name\":\"messageId\",\"type\":\"bytes32\"},{\"indexed\":true,\"internalType\":\"uint64\",\"name\":\"destinationChainSelector\",\"type\":\"uint64\"},{\"indexed\":false,\"internalType\":\"address\",\"name\":\"receiver\",\"type\":\"address\"},{\"indexed\":false,\"internalType\":\"string\",\"name\":\"text\",\"type\":\"string\"},{\"indexed\":false,\"internalType\":\"address\",\"name\":\"token\",\"type\":\"address\"},{\"indexed\":false,\"internalType\":\"uint256\",\"name\":\"tokenAmount\",\"type\":\"uint256\"},{\"indexed\":false,\"internalType\":\"address\",\"name\":\"feeToken\",\"type\":\"address\"},{\"indexed\":false,\"internalType\":\"uint256\",\"name\":\"fees\",\"type\":\"uint256\"}],\"name\":\"MessageSent\",\"type\":\"event\"},{\"anonymous\":false,\"inputs\":[{\"indexed\":true,\"internalType\":\"address\",\"name\":\"from\",\"type\":\"address\"},{\"indexed\":true,\"internalType\":\"address\",\"name\":\"to\",\"type\":\"address\"}],\"name\":\"OwnershipTransferRequested\",\"type\":\"event\"},{\"anonymous\":false,\"inputs\":[{\"indexed\":true,\"internalType\":\"address\",\"name\":\"from\",\"type\":\"address\"},{\"indexed\":true,\"internalType\":\"address\",\"name\":\"to\",\"type\":\"address\"}],\"name\":\"OwnershipTransferred\",\"type\":\"event\"},{\"inputs\":[],\"name\":\"acceptOwnership\",\"outputs\":[],\"stateMutability\":\"nonpayable\",\"type\":\"function\"},{\"inputs\":[{\"internalType\":\"uint64\",\"name\":\"_destinationChainSelector\",\"type\":\"uint64\"},{\"internalType\":\"bool\",\"name\":\"allowed\",\"type\":\"bool\"}],\"name\":\"allowlistDestinationChain\",\"outputs\":[],\"stateMutability\":\"nonpayable\",\"type\":\"function\"},{\"inputs\":[{\"internalType\":\"address\",\"name\":\"_sender\",\"type\":\"address\"},{\"internalType\":\"bool\",\"name\":\"allowed\",\"type\":\"bool\"}],\"name\":\"allowlistSender\",\"outputs\":[],\"stateMutability\":\"nonpayable\",\"type\":\"function\"},{\"inputs\":[{\"internalType\":\"uint64\",\"name\":\"_sourceChainSelector\",\"type\":\"uint64\"},{\"internalType\":\"bool\",\"name\":\"allowed\",\"type\":\"bool\"}],\"name\":\"allowlistSourceChain\",\"outputs\":[],\"stateMutability\":\"nonpayable\",\"type\":\"function\"},{\"inputs\":[{\"internalType\":\"uint64\",\"name\":\"\",\"type\":\"uint64\"}],\"name\":\"allowlistedDestinationChains\",\"outputs\":[{\"internalType\":\"bool\",\"name\":\"\",\"type\":\"bool\"}],\"stateMutability\":\"view\",\"type\":\"function\"},{\"inputs\":[{\"internalType\":\"address\",\"name\":\"\",\"type\":\"address\"}],\"name\":\"allowlistedSenders\",\"outputs\":[{\"internalType\":\"bool\",\"name\":\"\",\"type\":\"bool\"}],\"stateMutability\":\"view\",\"type\":\"function\"},{\"inputs\":[{\"internalType\":\"uint64\",\"name\":\"\",\"type\":\"uint64\"}],\"name\":\"allowlistedSourceChains\",\"outputs\":[{\"internalType\":\"bool\",\"name\":\"\",\"type\":\"bool\"}],\"stateMutability\":\"view\",\"type\":\"function\"},{\"inputs\":[{\"components\":[{\"internalType\":\"bytes32\",\"name\":\"messageId\",\"type\":\"bytes32\"},{\"internalType\":\"uint64\",\"name\":\"sourceChainSelector\",\"type\":\"uint64\"},{\"internalType\":\"bytes\",\"name\":\"sender\",\"type\":\"bytes\"},{\"internalType\":\"bytes\",\"name\":\"data\",\"type\":\"bytes\"},{\"components\":[{\"internalType\":\"address\",\"name\":\"token\",\"type\":\"address\"},{\"internalType\":\"uint256\",\"name\":\"amount\",\"type\":\"uint256\"}],\"internalType\":\"struct Client.EVMTokenAmount[]\",\"name\":\"destTokenAmounts\",\"type\":\"tuple[]\"}],\"internalType\":\"struct Client.Any2EVMMessage\",\"name\":\"message\",\"type\":\"tuple\"}],\"name\":\"ccipReceive\",\"outputs\":[],\"stateMutability\":\"nonpayable\",\"type\":\"function\"},{\"inputs\":[],\"name\":\"getLastReceivedMessageDetails\",\"outputs\":[{\"internalType\":\"bytes32\",\"name\":\"messageId\",\"type\":\"bytes32\"},{\"internalType\":\"string\",\"name\":\"text\",\"type\":\"string\"},{\"internalType\":\"address\",\"name\":\"tokenAddress\",\"type\":\"address\"},{\"internalType\":\"uint256\",\"name\":\"tokenAmount\",\"type\":\"uint256\"}],\"stateMutability\":\"view\",\"type\":\"function\"},{\"inputs\":[],\"name\":\"getRouter\",\"outputs\":[{\"internalType\":\"address\",\"name\":\"\",\"type\":\"address\"}],\"stateMutability\":\"view\",\"type\":\"function\"},{\"inputs\":[],\"name\":\"owner\",\"outputs\":[{\"internalType\":\"address\",\"name\":\"\",\"type\":\"address\"}],\"stateMutability\":\"view\",\"type\":\"function\"},{\"inputs\":[{\"internalType\":\"uint64\",\"name\":\"_destinationChainSelector\",\"type\":\"uint64\"},{\"internalType\":\"address\",\"name\":\"_receiver\",\"type\":\"address\"},{\"internalType\":\"string\",\"name\":\"_text\",\"type\":\"string\"},{\"internalType\":\"address\",\"name\":\"_token\",\"type\":\"address\"},{\"internalType\":\"uint256\",\"name\":\"_amount\",\"type\":\"uint256\"}],\"name\":\"sendMessagePayLINK\",\"outputs\":[{\"internalType\":\"bytes32\",\"name\":\"messageId\",\"type\":\"bytes32\"}],\"stateMutability\":\"nonpayable\",\"type\":\"function\"},{\"inputs\":[{\"internalType\":\"uint64\",\"name\":\"_destinationChainSelector\",\"type\":\"uint64\"},{\"internalType\":\"address\",\"name\":\"_receiver\",\"type\":\"address\"},{\"internalType\":\"string\",\"name\":\"_text\",\"type\":\"string\"},{\"internalType\":\"address\",\"name\":\"_token\",\"type\":\"address\"},{\"internalType\":\"uint256\",\"name\":\"_amount\",\"type\":\"uint256\"}],\"name\":\"sendMessagePayNative\",\"outputs\":[{\"internalType\":\"bytes32\",\"name\":\"messageId\",\"type\":\"bytes32\"}],\"stateMutability\":\"nonpayable\",\"type\":\"function\"},{\"inputs\":[{\"internalType\":\"bytes4\",\"name\":\"interfaceId\",\"type\":\"bytes4\"}],\"name\":\"supportsInterface\",\"outputs\":[{\"internalType\":\"bool\",\"name\":\"\",\"type\":\"bool\"}],\"stateMutability\":\"pure\",\"type\":\"function\"},{\"inputs\":[{\"internalType\":\"address\",\"name\":\"to\",\"type\":\"address\"}],\"name\":\"transferOwnership\",\"outputs\":[],\"stateMutability\":\"nonpayable\",\"type\":\"function\"},{\"inputs\":[{\"internalType\":\"address\",\"name\":\"_beneficiary\",\"type\":\"address\"}],\"name\":\"withdraw\",\"outputs\":[],\"stateMutability\":\"nonpayable\",\"type\":\"function\"},{\"inputs\":[{\"internalType\":\"address\",\"name\":\"_beneficiary\",\"type\":\"address\"},{\"internalType\":\"address\",\"name\":\"_token\",\"type\":\"address\"}],\"name\":\"withdrawToken\",\"outputs\":[],\"stateMutability\":\"nonpayable\",\"type\":\"function\"},{\"stateMutability\":\"payable\",\"type\":\"receive\"}],\"devdoc\":{\"kind\":\"dev\",\"methods\":{\"allowlistDestinationChain(uint64,bool)\":{\"details\":\"Updates the allowlist status of a destination chain for transactions.\",\"params\":{\"_destinationChainSelector\":\"The selector of the destination chain to be updated.\",\"allowed\":\"The allowlist status to be set for the destination chain.\"}},\"allowlistSender(address,bool)\":{\"details\":\"Updates the allowlist status of a sender for transactions.\",\"params\":{\"_sender\":\"The address of the sender to be updated.\",\"allowed\":\"The allowlist status to be set for the sender.\"}},\"allowlistSourceChain(uint64,bool)\":{\"details\":\"Updates the allowlist status of a source chain\",\"params\":{\"_sourceChainSelector\":\"The selector of the source chain to be updated.\",\"allowed\":\"The allowlist status to be set for the source chain.\"}},\"ccipReceive((bytes32,uint64,bytes,bytes,(address,uint256)[]))\":{\"details\":\"Note ensure you check the msg.sender is the OffRampRouter\",\"params\":{\"message\":\"CCIP Message\"}},\"constructor\":{\"params\":{\"_link\":\"The address of the link contract.\",\"_router\":\"The address of the router contract.\"}},\"getLastReceivedMessageDetails()\":{\"details\":\"This function retrieves the ID, text, token address, and token amount of the last received CCIP message.\",\"returns\":{\"messageId\":\"The ID of the last received CCIP message.\",\"text\":\"The text of the last received CCIP message.\",\"tokenAddress\":\"The address of the token in the last CCIP received message.\",\"tokenAmount\":\"The amount of the token in the last CCIP received message.\"}},\"getRouter()\":{\"returns\":{\"_0\":\"i_router address\"}},\"sendMessagePayLINK(uint64,address,string,address,uint256)\":{\"details\":\"Assumes your contract has sufficient LINK to pay for CCIP fees.\",\"params\":{\"_amount\":\"token amount.\",\"_destinationChainSelector\":\"The identifier (aka selector) for the destination blockchain.\",\"_receiver\":\"The address of the recipient on the destination blockchain.\",\"_text\":\"The string data to be sent.\",\"_token\":\"token address.\"},\"returns\":{\"messageId\":\"The ID of the CCIP message that was sent.\"}},\"sendMessagePayNative(uint64,address,string,address,uint256)\":{\"details\":\"Assumes your contract has sufficient native gas like ETH on Ethereum or MATIC on Polygon.\",\"params\":{\"_amount\":\"token amount.\",\"_destinationChainSelector\":\"The identifier (aka selector) for the destination blockchain.\",\"_receiver\":\"The address of the recipient on the destination blockchain.\",\"_text\":\"The string data to be sent.\",\"_token\":\"token address.\"},\"returns\":{\"messageId\":\"The ID of the CCIP message that was sent.\"}},\"supportsInterface(bytes4)\":{\"params\":{\"interfaceId\":\"The interfaceId to check\"},\"returns\":{\"_0\":\"true if the interfaceId is supported\"}},\"withdraw(address)\":{\"details\":\"This function reverts if there are no funds to withdraw or if the transfer fails. It should only be callable by the owner of the contract.\",\"params\":{\"_beneficiary\":\"The address to which the Ether should be sent.\"}},\"withdrawToken(address,address)\":{\"details\":\"This function reverts with a 'NothingToWithdraw' error if there are no tokens to withdraw.\",\"params\":{\"_beneficiary\":\"The address to which the tokens will be sent.\",\"_token\":\"The contract address of the ERC20 token to be withdrawn.\"}}},\"title\":\"- A simple messenger contract for transferring/receiving tokens and data across chains.\",\"version\":1},\"userdoc\":{\"kind\":\"user\",\"methods\":{\"acceptOwnership()\":{\"notice\":\"Allows an ownership transfer to be completed by the recipient.\"},\"allowlistDestinationChain(uint64,bool)\":{\"notice\":\"This function can only be called by the owner.\"},\"allowlistSender(address,bool)\":{\"notice\":\"This function can only be called by the owner.\"},\"allowlistSourceChain(uint64,bool)\":{\"notice\":\"This function can only be called by the owner.\"},\"ccipReceive((bytes32,uint64,bytes,bytes,(address,uint256)[]))\":{\"notice\":\"Called by the Router to deliver a message. If this reverts, any token transfers also revert. The message will move to a FAILED state and become available for manual execution.\"},\"constructor\":{\"notice\":\"Constructor initializes the contract with the router address.\"},\"getLastReceivedMessageDetails()\":{\"notice\":\"Returns the details of the last CCIP received message.\"},\"getRouter()\":{\"notice\":\"Return the current router\"},\"owner()\":{\"notice\":\"Get the current owner\"},\"sendMessagePayLINK(uint64,address,string,address,uint256)\":{\"notice\":\"Sends data and transfer tokens to receiver on the destination chain.Pay for fees in LINK.\"},\"sendMessagePayNative(uint64,address,string,address,uint256)\":{\"notice\":\"Sends data and transfer tokens to receiver on the destination chain.Pay for fees in native gas.\"},\"supportsInterface(bytes4)\":{\"notice\":\"IERC165 supports an interfaceId\"},\"transferOwnership(address)\":{\"notice\":\"Allows an owner to begin transferring ownership to a new address, pending.\"},\"withdraw(address)\":{\"notice\":\"Allows the contract owner to withdraw the entire balance of Ether from the contract.\"},\"withdrawToken(address,address)\":{\"notice\":\"Allows the owner of the contract to withdraw all tokens of a specific ERC20 token.\"}},\"version\":1}},\"settings\":{\"compilationTarget\":{\"contracts/CCIP/ProgrammableTokenTransfers.sol\":\"ProgrammableTokenTransfers\"},\"evmVersion\":\"paris\",\"libraries\":{},\"metadata\":{\"bytecodeHash\":\"ipfs\",\"useLiteralContent\":true},\"optimizer\":{\"enabled\":true,\"runs\":200},\"remappings\":[]},\"sources\":{\"@chainlink/contracts-ccip/src/v0.8/ConfirmedOwner.sol\":{\"content\":\"// SPDX-License-Identifier: MIT\\npragma solidity ^0.8.0;\\n\\nimport \\\"./ConfirmedOwnerWithProposal.sol\\\";\\n\\n/**\\n * @title The ConfirmedOwner contract\\n * @notice A contract with helpers for basic contract ownership.\\n */\\ncontract ConfirmedOwner is ConfirmedOwnerWithProposal {\\n  constructor(address newOwner) ConfirmedOwnerWithProposal(newOwner, address(0)) {}\\n}\\n\",\"keccak256\":\"0x99d0b0786fe368970009c703f2249bfbc56340ddf1a28b60d2915bb58c34cd72\",\"license\":\"MIT\"},\"@chainlink/contracts-ccip/src/v0.8/ConfirmedOwnerWithProposal.sol\":{\"content\":\"// SPDX-License-Identifier: MIT\\npragma solidity ^0.8.0;\\n\\nimport \\\"./interfaces/OwnableInterface.sol\\\";\\n\\n/**\\n * @title The ConfirmedOwner contract\\n * @notice A contract with helpers for basic contract ownership.\\n */\\ncontract ConfirmedOwnerWithProposal is OwnableInterface {\\n  address private s_owner;\\n  address private s_pendingOwner;\\n\\n  event OwnershipTransferRequested(address indexed from, address indexed to);\\n  event OwnershipTransferred(address indexed from, address indexed to);\\n\\n  constructor(address newOwner, address pendingOwner) {\\n    require(newOwner != address(0), \\\"Cannot set owner to zero\\\");\\n\\n    s_owner = newOwner;\\n    if (pendingOwner != address(0)) {\\n      _transferOwnership(pendingOwner);\\n    }\\n  }\\n\\n  /**\\n   * @notice Allows an owner to begin transferring ownership to a new address,\\n   * pending.\\n   */\\n  function transferOwnership(address to) public override onlyOwner {\\n    _transferOwnership(to);\\n  }\\n\\n  /**\\n   * @notice Allows an ownership transfer to be completed by the recipient.\\n   */\\n  function acceptOwnership() external override {\\n    require(msg.sender == s_pendingOwner, \\\"Must be proposed owner\\\");\\n\\n    address oldOwner = s_owner;\\n    s_owner = msg.sender;\\n    s_pendingOwner = address(0);\\n\\n    emit OwnershipTransferred(oldOwner, msg.sender);\\n  }\\n\\n  /**\\n   * @notice Get the current owner\\n   */\\n  function owner() public view override returns (address) {\\n    return s_owner;\\n  }\\n\\n  /**\\n   * @notice validate, transfer ownership, and emit relevant events\\n   */\\n  function _transferOwnership(address to) private {\\n    require(to != msg.sender, \\\"Cannot transfer to self\\\");\\n\\n    s_pendingOwner = to;\\n\\n    emit OwnershipTransferRequested(s_owner, to);\\n  }\\n\\n  /**\\n   * @notice validate access\\n   */\\n  function _validateOwnership() internal view {\\n    require(msg.sender == s_owner, \\\"Only callable by owner\\\");\\n  }\\n\\n  /**\\n   * @notice Reverts if called by anyone other than the contract owner.\\n   */\\n  modifier onlyOwner() {\\n    _validateOwnership();\\n    _;\\n  }\\n}\\n\",\"keccak256\":\"0xa2f137a1d066795aeac76226e58f33c982278cdd34b4f09e5a2243d5a0924654\",\"license\":\"MIT\"},\"@chainlink/contracts-ccip/src/v0.8/ccip/applications/CCIPReceiver.sol\":{\"content\":\"// SPDX-License-Identifier: MIT\\npragma solidity ^0.8.0;\\n\\nimport {IAny2EVMMessageReceiver} from \\\"../interfaces/IAny2EVMMessageReceiver.sol\\\";\\n\\nimport {Client} from \\\"../libraries/Client.sol\\\";\\n\\nimport {IERC165} from \\\"../../vendor/openzeppelin-solidity/v4.8.0/utils/introspection/IERC165.sol\\\";\\n\\n/// @title CCIPReceiver - Base contract for CCIP applications that can receive messages.\\nabstract contract CCIPReceiver is IAny2EVMMessageReceiver, IERC165 {\\n  address internal immutable i_router;\\n\\n  constructor(address router) {\\n    if (router == address(0)) revert InvalidRouter(address(0));\\n    i_router = router;\\n  }\\n\\n  /// @notice IERC165 supports an interfaceId\\n  /// @param interfaceId The interfaceId to check\\n  /// @return true if the interfaceId is supported\\n  function supportsInterface(bytes4 interfaceId) public pure override returns (bool) {\\n    return interfaceId == type(IAny2EVMMessageReceiver).interfaceId || interfaceId == type(IERC165).interfaceId;\\n  }\\n\\n  /// @inheritdoc IAny2EVMMessageReceiver\\n  function ccipReceive(Client.Any2EVMMessage calldata message) external virtual override onlyRouter {\\n    _ccipReceive(message);\\n  }\\n\\n  /// @notice Override this function in your implementation.\\n  /// @param message Any2EVMMessage\\n  function _ccipReceive(Client.Any2EVMMessage memory message) internal virtual;\\n\\n  /////////////////////////////////////////////////////////////////////\\n  // Plumbing\\n  /////////////////////////////////////////////////////////////////////\\n\\n  /// @notice Return the current router\\n  /// @return i_router address\\n  function getRouter() public view returns (address) {\\n    return address(i_router);\\n  }\\n\\n  error InvalidRouter(address router);\\n\\n  /// @dev only calls from the set router are accepted.\\n  modifier onlyRouter() {\\n    if (msg.sender != address(i_router)) revert InvalidRouter(msg.sender);\\n    _;\\n  }\\n}\\n\",\"keccak256\":\"0xcf5d0a5cd6ed0f6a9ed721b3e532c0504ed1ba3ab6d3567165876ceb4f23b084\",\"license\":\"MIT\"},\"@chainlink/contracts-ccip/src/v0.8/ccip/interfaces/IAny2EVMMessageReceiver.sol\":{\"content\":\"// SPDX-License-Identifier: MIT\\npragma solidity ^0.8.0;\\n\\nimport {Client} from \\\"../libraries/Client.sol\\\";\\n\\n/// @notice Application contracts that intend to receive messages from\\n/// the router should implement this interface.\\ninterface IAny2EVMMessageReceiver {\\n  /// @notice Called by the Router to deliver a message.\\n  /// If this reverts, any token transfers also revert. The message\\n  /// will move to a FAILED state and become available for manual execution.\\n  /// @param message CCIP Message\\n  /// @dev Note ensure you check the msg.sender is the OffRampRouter\\n  function ccipReceive(Client.Any2EVMMessage calldata message) external;\\n}\\n\",\"keccak256\":\"0xd2a05a4f58a453cbf8cfa6aa78f58cb8e42091b3a025f711a0aa51f584e16b48\",\"license\":\"MIT\"},\"@chainlink/contracts-ccip/src/v0.8/ccip/interfaces/IRouterClient.sol\":{\"content\":\"// SPDX-License-Identifier: MIT\\npragma solidity ^0.8.0;\\n\\nimport {Client} from \\\"../libraries/Client.sol\\\";\\n\\ninterface IRouterClient {\\n  error UnsupportedDestinationChain(uint64 destChainSelector);\\n  error InsufficientFeeTokenAmount();\\n  error InvalidMsgValue();\\n\\n  /// @notice Checks if the given chain ID is supported for sending/receiving.\\n  /// @param chainSelector The chain to check.\\n  /// @return supported is true if it is supported, false if not.\\n  function isChainSupported(uint64 chainSelector) external view returns (bool supported);\\n\\n  /// @notice Gets a list of all supported tokens which can be sent or received\\n  /// to/from a given chain id.\\n  /// @param chainSelector The chainSelector.\\n  /// @return tokens The addresses of all tokens that are supported.\\n  function getSupportedTokens(uint64 chainSelector) external view returns (address[] memory tokens);\\n\\n  /// @param destinationChainSelector The destination chainSelector\\n  /// @param message The cross-chain CCIP message including data and/or tokens\\n  /// @return fee returns guaranteed execution fee for the specified message\\n  /// delivery to destination chain\\n  /// @dev returns 0 fee on invalid message.\\n  function getFee(\\n    uint64 destinationChainSelector,\\n    Client.EVM2AnyMessage memory message\\n  ) external view returns (uint256 fee);\\n\\n  /// @notice Request a message to be sent to the destination chain\\n  /// @param destinationChainSelector The destination chain ID\\n  /// @param message The cross-chain CCIP message including data and/or tokens\\n  /// @return messageId The message ID\\n  /// @dev Note if msg.value is larger than the required fee (from getFee) we accept\\n  /// the overpayment with no refund.\\n  function ccipSend(\\n    uint64 destinationChainSelector,\\n    Client.EVM2AnyMessage calldata message\\n  ) external payable returns (bytes32);\\n}\\n\",\"keccak256\":\"0x9899fab6a40f68408ddf153612c553f2441ea27770176bf71ccce22c40393286\",\"license\":\"MIT\"},\"@chainlink/contracts-ccip/src/v0.8/ccip/libraries/Client.sol\":{\"content\":\"// SPDX-License-Identifier: MIT\\npragma solidity ^0.8.0;\\n\\n// End consumer library.\\nlibrary Client {\\n  struct EVMTokenAmount {\\n    address token; // token address on the local chain.\\n    uint256 amount; // Amount of tokens.\\n  }\\n\\n  struct Any2EVMMessage {\\n    bytes32 messageId; // MessageId corresponding to ccipSend on source.\\n    uint64 sourceChainSelector; // Source chain selector.\\n    bytes sender; // abi.decode(sender) if coming from an EVM chain.\\n    bytes data; // payload sent in original message.\\n    EVMTokenAmount[] destTokenAmounts; // Tokens and their amounts in their destination chain representation.\\n  }\\n\\n  // If extraArgs is empty bytes, the default is 200k gas limit and strict = false.\\n  struct EVM2AnyMessage {\\n    bytes receiver; // abi.encode(receiver address) for dest EVM chains\\n    bytes data; // Data payload\\n    EVMTokenAmount[] tokenAmounts; // Token transfers\\n    address feeToken; // Address of feeToken. address(0) means you will send msg.value.\\n    bytes extraArgs; // Populate this with _argsToBytes(EVMExtraArgsV1)\\n  }\\n\\n  // extraArgs will evolve to support new features\\n  // bytes4(keccak256(\\\"CCIP EVMExtraArgsV1\\\"));\\n  bytes4 public constant EVM_EXTRA_ARGS_V1_TAG = 0x97a657c9;\\n  struct EVMExtraArgsV1 {\\n    uint256 gasLimit; // ATTENTION!!! MAX GAS LIMIT 4M FOR BETA TESTING\\n    bool strict; // See strict sequencing details below.\\n  }\\n\\n  function _argsToBytes(EVMExtraArgsV1 memory extraArgs) internal pure returns (bytes memory bts) {\\n    return abi.encodeWithSelector(EVM_EXTRA_ARGS_V1_TAG, extraArgs);\\n  }\\n}\\n\",\"keccak256\":\"0x2fb8e11d517fa5ee213aaab3f4d416155cd2b72d61ba443dbeff6b41d29e9523\",\"license\":\"MIT\"},\"@chainlink/contracts-ccip/src/v0.8/interfaces/OwnableInterface.sol\":{\"content\":\"// SPDX-License-Identifier: MIT\\npragma solidity ^0.8.0;\\n\\ninterface OwnableInterface {\\n  function owner() external returns (address);\\n\\n  function transferOwnership(address recipient) external;\\n\\n  function acceptOwnership() external;\\n}\\n\",\"keccak256\":\"0xb8b3a97783dddc198b790c4cec1eda7fb47aa38cbaea6555220d0ed8c735c086\",\"license\":\"MIT\"},\"@chainlink/contracts-ccip/src/v0.8/shared/access/OwnerIsCreator.sol\":{\"content\":\"// SPDX-License-Identifier: MIT\\npragma solidity ^0.8.0;\\n\\nimport {ConfirmedOwner} from \\\"../../ConfirmedOwner.sol\\\";\\n\\n/// @title The OwnerIsCreator contract\\n/// @notice A contract with helpers for basic contract ownership.\\ncontract OwnerIsCreator is ConfirmedOwner {\\n  constructor() ConfirmedOwner(msg.sender) {}\\n}\\n\",\"keccak256\":\"0x010d0a67d81c4020004f72d95e8a7b08b98178de026e96565f315806e7525ada\",\"license\":\"MIT\"},\"@chainlink/contracts-ccip/src/v0.8/vendor/openzeppelin-solidity/v4.8.0/token/ERC20/IERC20.sol\":{\"content\":\"// SPDX-License-Identifier: MIT\\n// OpenZeppelin Contracts (last updated v4.6.0) (token/ERC20/IERC20.sol)\\n\\npragma solidity ^0.8.0;\\n\\n/**\\n * @dev Interface of the ERC20 standard as defined in the EIP.\\n */\\ninterface IERC20 {\\n  /**\\n   * @dev Emitted when `value` tokens are moved from one account (`from`) to\\n   * another (`to`).\\n   *\\n   * Note that `value` may be zero.\\n   */\\n  event Transfer(address indexed from, address indexed to, uint256 value);\\n\\n  /**\\n   * @dev Emitted when the allowance of a `spender` for an `owner` is set by\\n   * a call to {approve}. `value` is the new allowance.\\n   */\\n  event Approval(address indexed owner, address indexed spender, uint256 value);\\n\\n  /**\\n   * @dev Returns the amount of tokens in existence.\\n   */\\n  function totalSupply() external view returns (uint256);\\n\\n  /**\\n   * @dev Returns the amount of tokens owned by `account`.\\n   */\\n  function balanceOf(address account) external view returns (uint256);\\n\\n  /**\\n   * @dev Moves `amount` tokens from the caller's account to `to`.\\n   *\\n   * Returns a boolean value indicating whether the operation succeeded.\\n   *\\n   * Emits a {Transfer} event.\\n   */\\n  function transfer(address to, uint256 amount) external returns (bool);\\n\\n  /**\\n   * @dev Returns the remaining number of tokens that `spender` will be\\n   * allowed to spend on behalf of `owner` through {transferFrom}. This is\\n   * zero by default.\\n   *\\n   * This value changes when {approve} or {transferFrom} are called.\\n   */\\n  function allowance(address owner, address spender) external view returns (uint256);\\n\\n  /**\\n   * @dev Sets `amount` as the allowance of `spender` over the caller's tokens.\\n   *\\n   * Returns a boolean value indicating whether the operation succeeded.\\n   *\\n   * IMPORTANT: Beware that changing an allowance with this method brings the risk\\n   * that someone may use both the old and the new allowance by unfortunate\\n   * transaction ordering. One possible solution to mitigate this race\\n   * condition is to first reduce the spender's allowance to 0 and set the\\n   * desired value afterwards:\\n   * https://github.com/ethereum/EIPs/issues/20#issuecomment-263524729\\n   *\\n   * Emits an {Approval} event.\\n   */\\n  function approve(address spender, uint256 amount) external returns (bool);\\n\\n  /**\\n   * @dev Moves `amount` tokens from `from` to `to` using the\\n   * allowance mechanism. `amount` is then deducted from the caller's\\n   * allowance.\\n   *\\n   * Returns a boolean value indicating whether the operation succeeded.\\n   *\\n   * Emits a {Transfer} event.\\n   */\\n  function transferFrom(\\n    address from,\\n    address to,\\n    uint256 amount\\n  ) external returns (bool);\\n}\",\"keccak256\":\"0xf7a52b7d3a7b79117544d6bbeb8564bd22c760c4937d69914b99641a957a8f2a\",\"license\":\"MIT\"},\"@chainlink/contracts-ccip/src/v0.8/vendor/openzeppelin-solidity/v4.8.0/utils/introspection/IERC165.sol\":{\"content\":\"// SPDX-License-Identifier: MIT\\n// OpenZeppelin Contracts v4.4.1 (utils/introspection/IERC165.sol)\\n\\npragma solidity ^0.8.0;\\n\\n/**\\n * @dev Interface of the ERC165 standard, as defined in the\\n * https://eips.ethereum.org/EIPS/eip-165[EIP].\\n *\\n * Implementers can declare support of contract interfaces, which can then be\\n * queried by others ({ERC165Checker}).\\n *\\n * For an implementation, see {ERC165}.\\n */\\ninterface IERC165 {\\n  /**\\n    * @dev Returns true if this contract implements the interface defined by\\n    * `interfaceId`. See the corresponding\\n    * https://eips.ethereum.org/EIPS/eip-165#how-interfaces-are-identified[EIP section]\\n    * to learn more about how these ids are created.\\n    *\\n    * This function call must use less than 30 000 gas.\\n    */\\n  function supportsInterface(bytes4 interfaceId) external view returns (bool);\\n}\",\"keccak256\":\"0xac7a4bfe791ee9fe125cac5cd25795b326433e5cf2bdd6b02ad6ad42c2d126a5\",\"license\":\"MIT\"},\"contracts/CCIP/ProgrammableTokenTransfers.sol\":{\"content\":\"// SPDX-License-Identifier: MIT\\npragma solidity 0.8.19;\\n\\nimport {IRouterClient} from \\\"@chainlink/contracts-ccip/src/v0.8/ccip/interfaces/IRouterClient.sol\\\";\\nimport {OwnerIsCreator} from \\\"@chainlink/contracts-ccip/src/v0.8/shared/access/OwnerIsCreator.sol\\\";\\nimport {Client} from \\\"@chainlink/contracts-ccip/src/v0.8/ccip/libraries/Client.sol\\\";\\nimport {CCIPReceiver} from \\\"@chainlink/contracts-ccip/src/v0.8/ccip/applications/CCIPReceiver.sol\\\";\\nimport {IERC20} from \\\"@chainlink/contracts-ccip/src/v0.8/vendor/openzeppelin-solidity/v4.8.0/token/ERC20/IERC20.sol\\\";\\n\\n/**\\n * THIS IS AN EXAMPLE CONTRACT THAT USES HARDCODED VALUES FOR CLARITY.\\n * THIS IS AN EXAMPLE CONTRACT THAT USES UN-AUDITED CODE.\\n * DO NOT USE THIS CODE IN PRODUCTION.\\n */\\n\\n/// @title - A simple messenger contract for transferring/receiving tokens and data across chains.\\ncontract ProgrammableTokenTransfers is CCIPReceiver, OwnerIsCreator {\\n    // Custom errors to provide more descriptive revert messages.\\n    error NotEnoughBalance(uint256 currentBalance, uint256 calculatedFees); // Used to make sure contract has enough balance to cover the fees.\\n    error NothingToWithdraw(); // Used when trying to withdraw Ether but there's nothing to withdraw.\\n    error FailedToWithdrawEth(address owner, address target, uint256 value); // Used when the withdrawal of Ether fails.\\n    error DestinationChainNotAllowed(uint64 destinationChainSelector); // Used when the destination chain has not been allowlisted by the contract owner.\\n    error SourceChainNotAllowed(uint64 sourceChainSelector); // Used when the source chain has not been allowlisted by the contract owner.\\n    error SenderNotAllowed(address sender); // Used when the sender has not been allowlisted by the contract owner.\\n\\n    // Event emitted when a message is sent to another chain.\\n    event MessageSent(\\n        bytes32 indexed messageId, // The unique ID of the CCIP message.\\n        uint64 indexed destinationChainSelector, // The chain selector of the destination chain.\\n        address receiver, // The address of the receiver on the destination chain.\\n        string text, // The text being sent.\\n        address token, // The token address that was transferred.\\n        uint256 tokenAmount, // The token amount that was transferred.\\n        address feeToken, // the token address used to pay CCIP fees.\\n        uint256 fees // The fees paid for sending the message.\\n    );\\n\\n    // Event emitted when a message is received from another chain.\\n    event MessageReceived(\\n        bytes32 indexed messageId, // The unique ID of the CCIP message.\\n        uint64 indexed sourceChainSelector, // The chain selector of the source chain.\\n        address sender, // The address of the sender from the source chain.\\n        string text, // The text that was received.\\n        address token, // The token address that was transferred.\\n        uint256 tokenAmount // The token amount that was transferred.\\n    );\\n\\n    bytes32 private s_lastReceivedMessageId; // Store the last received messageId.\\n    address private s_lastReceivedTokenAddress; // Store the last received token address.\\n    uint256 private s_lastReceivedTokenAmount; // Store the last received amount.\\n    string private s_lastReceivedText; // Store the last received text.\\n\\n    // Mapping to keep track of allowlisted destination chains.\\n    mapping(uint64 => bool) public allowlistedDestinationChains;\\n\\n    // Mapping to keep track of allowlisted source chains.\\n    mapping(uint64 => bool) public allowlistedSourceChains;\\n\\n    // Mapping to keep track of allowlisted senders.\\n    mapping(address => bool) public allowlistedSenders;\\n\\n    IERC20 private s_linkToken;\\n\\n    /// @notice Constructor initializes the contract with the router address.\\n    /// @param _router The address of the router contract.\\n    /// @param _link The address of the link contract.\\n    constructor(address _router, address _link) CCIPReceiver(_router) {\\n        s_linkToken = IERC20(_link);\\n    }\\n\\n    /// @dev Modifier that checks if the chain with the given destinationChainSelector is allowlisted.\\n    /// @param _destinationChainSelector The selector of the destination chain.\\n    modifier onlyAllowlistedDestinationChain(uint64 _destinationChainSelector) {\\n        if (!allowlistedDestinationChains[_destinationChainSelector])\\n            revert DestinationChainNotAllowed(_destinationChainSelector);\\n        _;\\n    }\\n\\n    /// @dev Modifier that checks if the chain with the given sourceChainSelector is allowlisted and if the sender is allowlisted.\\n    /// @param _sourceChainSelector The selector of the destination chain.\\n    /// @param _sender The address of the sender.\\n    modifier onlyAllowlisted(uint64 _sourceChainSelector, address _sender) {\\n        if (!allowlistedSourceChains[_sourceChainSelector]) revert SourceChainNotAllowed(_sourceChainSelector);\\n        if (!allowlistedSenders[_sender]) revert SenderNotAllowed(_sender);\\n        _;\\n    }\\n\\n    /// @dev Updates the allowlist status of a destination chain for transactions.\\n    /// @notice This function can only be called by the owner.\\n    /// @param _destinationChainSelector The selector of the destination chain to be updated.\\n    /// @param allowed The allowlist status to be set for the destination chain.\\n    function allowlistDestinationChain(uint64 _destinationChainSelector, bool allowed) external onlyOwner {\\n        allowlistedDestinationChains[_destinationChainSelector] = allowed;\\n    }\\n\\n    /// @dev Updates the allowlist status of a source chain\\n    /// @notice This function can only be called by the owner.\\n    /// @param _sourceChainSelector The selector of the source chain to be updated.\\n    /// @param allowed The allowlist status to be set for the source chain.\\n    function allowlistSourceChain(uint64 _sourceChainSelector, bool allowed) external onlyOwner {\\n        allowlistedSourceChains[_sourceChainSelector] = allowed;\\n    }\\n\\n    /// @dev Updates the allowlist status of a sender for transactions.\\n    /// @notice This function can only be called by the owner.\\n    /// @param _sender The address of the sender to be updated.\\n    /// @param allowed The allowlist status to be set for the sender.\\n    function allowlistSender(address _sender, bool allowed) external onlyOwner {\\n        allowlistedSenders[_sender] = allowed;\\n    }\\n\\n    /// @notice Sends data and transfer tokens to receiver on the destination chain.\\n    /// @notice Pay for fees in LINK.\\n    /// @dev Assumes your contract has sufficient LINK to pay for CCIP fees.\\n    /// @param _destinationChainSelector The identifier (aka selector) for the destination blockchain.\\n    /// @param _receiver The address of the recipient on the destination blockchain.\\n    /// @param _text The string data to be sent.\\n    /// @param _token token address.\\n    /// @param _amount token amount.\\n    /// @return messageId The ID of the CCIP message that was sent.\\n    function sendMessagePayLINK(\\n        uint64 _destinationChainSelector,\\n        address _receiver,\\n        string calldata _text,\\n        address _token,\\n        uint256 _amount\\n    ) external onlyOwner onlyAllowlistedDestinationChain(_destinationChainSelector) returns (bytes32 messageId) {\\n        // Create an EVM2AnyMessage struct in memory with necessary information for sending a cross-chain message\\n        // address(linkToken) means fees are paid in LINK\\n        Client.EVM2AnyMessage memory evm2AnyMessage = _buildCCIPMessage(\\n            _receiver,\\n            _text,\\n            _token,\\n            _amount,\\n            address(s_linkToken)\\n        );\\n\\n        // Initialize a router client instance to interact with cross-chain router\\n        IRouterClient router = IRouterClient(this.getRouter());\\n\\n        // Get the fee required to send the CCIP message\\n        uint256 fees = router.getFee(_destinationChainSelector, evm2AnyMessage);\\n\\n        if (fees > s_linkToken.balanceOf(address(this)))\\n            revert NotEnoughBalance(s_linkToken.balanceOf(address(this)), fees);\\n\\n        // approve the Router to transfer LINK tokens on contract's behalf. It will spend the fees in LINK\\n        s_linkToken.approve(address(router), fees);\\n\\n        // approve the Router to spend tokens on contract's behalf. It will spend the amount of the given token\\n        IERC20(_token).approve(address(router), _amount);\\n\\n        // Send the message through the router and store the returned message ID\\n        messageId = router.ccipSend(_destinationChainSelector, evm2AnyMessage);\\n\\n        // Emit an event with message details\\n        emit MessageSent(\\n            messageId,\\n            _destinationChainSelector,\\n            _receiver,\\n            _text,\\n            _token,\\n            _amount,\\n            address(s_linkToken),\\n            fees\\n        );\\n\\n        // Return the message ID\\n        return messageId;\\n    }\\n\\n    /// @notice Sends data and transfer tokens to receiver on the destination chain.\\n    /// @notice Pay for fees in native gas.\\n    /// @dev Assumes your contract has sufficient native gas like ETH on Ethereum or MATIC on Polygon.\\n    /// @param _destinationChainSelector The identifier (aka selector) for the destination blockchain.\\n    /// @param _receiver The address of the recipient on the destination blockchain.\\n    /// @param _text The string data to be sent.\\n    /// @param _token token address.\\n    /// @param _amount token amount.\\n    /// @return messageId The ID of the CCIP message that was sent.\\n    function sendMessagePayNative(\\n        uint64 _destinationChainSelector,\\n        address _receiver,\\n        string calldata _text,\\n        address _token,\\n        uint256 _amount\\n    ) external onlyOwner onlyAllowlistedDestinationChain(_destinationChainSelector) returns (bytes32 messageId) {\\n        // Create an EVM2AnyMessage struct in memory with necessary information for sending a cross-chain message\\n        // address(0) means fees are paid in native gas\\n        Client.EVM2AnyMessage memory evm2AnyMessage = _buildCCIPMessage(_receiver, _text, _token, _amount, address(0));\\n\\n        // Initialize a router client instance to interact with cross-chain router\\n        IRouterClient router = IRouterClient(this.getRouter());\\n\\n        // Get the fee required to send the CCIP message\\n        uint256 fees = router.getFee(_destinationChainSelector, evm2AnyMessage);\\n\\n        if (fees > address(this).balance) revert NotEnoughBalance(address(this).balance, fees);\\n\\n        // approve the Router to spend tokens on contract's behalf. It will spend the amount of the given token\\n        IERC20(_token).approve(address(router), _amount);\\n\\n        // Send the message through the router and store the returned message ID\\n        messageId = router.ccipSend{value: fees}(_destinationChainSelector, evm2AnyMessage);\\n\\n        // Emit an event with message details\\n        emit MessageSent(messageId, _destinationChainSelector, _receiver, _text, _token, _amount, address(0), fees);\\n\\n        // Return the message ID\\n        return messageId;\\n    }\\n\\n    /**\\n     * @notice Returns the details of the last CCIP received message.\\n     * @dev This function retrieves the ID, text, token address, and token amount of the last received CCIP message.\\n     * @return messageId The ID of the last received CCIP message.\\n     * @return text The text of the last received CCIP message.\\n     * @return tokenAddress The address of the token in the last CCIP received message.\\n     * @return tokenAmount The amount of the token in the last CCIP received message.\\n     */\\n    function getLastReceivedMessageDetails()\\n        public\\n        view\\n        returns (bytes32 messageId, string memory text, address tokenAddress, uint256 tokenAmount)\\n    {\\n        return (s_lastReceivedMessageId, s_lastReceivedText, s_lastReceivedTokenAddress, s_lastReceivedTokenAmount);\\n    }\\n\\n    /// handle a received message\\n    function _ccipReceive(\\n        Client.Any2EVMMessage memory any2EvmMessage\\n    )\\n        internal\\n        override\\n        onlyAllowlisted(any2EvmMessage.sourceChainSelector, abi.decode(any2EvmMessage.sender, (address))) // Make sure source chain and sender are allowlisted\\n    {\\n        s_lastReceivedMessageId = any2EvmMessage.messageId; // fetch the messageId\\n        s_lastReceivedText = abi.decode(any2EvmMessage.data, (string)); // abi-decoding of the sent text\\n        // Expect one token to be transferred at once, but you can transfer several tokens.\\n        s_lastReceivedTokenAddress = any2EvmMessage.destTokenAmounts[0].token;\\n        s_lastReceivedTokenAmount = any2EvmMessage.destTokenAmounts[0].amount;\\n\\n        emit MessageReceived(\\n            any2EvmMessage.messageId,\\n            any2EvmMessage.sourceChainSelector, // fetch the source chain identifier (aka selector)\\n            abi.decode(any2EvmMessage.sender, (address)), // abi-decoding of the sender address,\\n            abi.decode(any2EvmMessage.data, (string)),\\n            any2EvmMessage.destTokenAmounts[0].token,\\n            any2EvmMessage.destTokenAmounts[0].amount\\n        );\\n    }\\n\\n    /// @notice Construct a CCIP message.\\n    /// @dev This function will create an EVM2AnyMessage struct with all the necessary information for programmable tokens transfer.\\n    /// @param _receiver The address of the receiver.\\n    /// @param _text The string data to be sent.\\n    /// @param _token The token to be transferred.\\n    /// @param _amount The amount of the token to be transferred.\\n    /// @param _feeTokenAddress The address of the token used for fees. Set address(0) for native gas.\\n    /// @return Client.EVM2AnyMessage Returns an EVM2AnyMessage struct which contains information for sending a CCIP message.\\n    function _buildCCIPMessage(\\n        address _receiver,\\n        string calldata _text,\\n        address _token,\\n        uint256 _amount,\\n        address _feeTokenAddress\\n    ) internal pure returns (Client.EVM2AnyMessage memory) {\\n        // Set the token amounts\\n        Client.EVMTokenAmount[] memory tokenAmounts = new Client.EVMTokenAmount[](1);\\n        tokenAmounts[0] = Client.EVMTokenAmount({token: _token, amount: _amount});\\n        // Create an EVM2AnyMessage struct in memory with necessary information for sending a cross-chain message\\n        return\\n            Client.EVM2AnyMessage({\\n                receiver: abi.encode(_receiver), // ABI-encoded receiver address\\n                data: abi.encode(_text), // ABI-encoded string\\n                tokenAmounts: tokenAmounts, // The amount and type of token being transferred\\n                extraArgs: Client._argsToBytes(\\n                    // Additional arguments, setting gas limit and non-strict sequencing mode\\n                    Client.EVMExtraArgsV1({gasLimit: 200_000, strict: false})\\n                ),\\n                // Set the feeToken to a feeTokenAddress, indicating specific asset will be used for fees\\n                feeToken: _feeTokenAddress\\n            });\\n    }\\n\\n    /// @notice Fallback function to allow the contract to receive Ether.\\n    /// @dev This function has no function body, making it a default function for receiving Ether.\\n    /// It is automatically called when Ether is sent to the contract without any data.\\n    receive() external payable {}\\n\\n    /// @notice Allows the contract owner to withdraw the entire balance of Ether from the contract.\\n    /// @dev This function reverts if there are no funds to withdraw or if the transfer fails.\\n    /// It should only be callable by the owner of the contract.\\n    /// @param _beneficiary The address to which the Ether should be sent.\\n    function withdraw(address _beneficiary) public onlyOwner {\\n        // Retrieve the balance of this contract\\n        uint256 amount = address(this).balance;\\n\\n        // Revert if there is nothing to withdraw\\n        if (amount == 0) revert NothingToWithdraw();\\n\\n        // Attempt to send the funds, capturing the success status and discarding any return data\\n        (bool sent, ) = _beneficiary.call{value: amount}(\\\"\\\");\\n\\n        // Revert if the send failed, with information about the attempted transfer\\n        if (!sent) revert FailedToWithdrawEth(msg.sender, _beneficiary, amount);\\n    }\\n\\n    /// @notice Allows the owner of the contract to withdraw all tokens of a specific ERC20 token.\\n    /// @dev This function reverts with a 'NothingToWithdraw' error if there are no tokens to withdraw.\\n    /// @param _beneficiary The address to which the tokens will be sent.\\n    /// @param _token The contract address of the ERC20 token to be withdrawn.\\n    function withdrawToken(address _beneficiary, address _token) public onlyOwner {\\n        // Retrieve the balance of this contract\\n        uint256 amount = IERC20(_token).balanceOf(address(this));\\n\\n        // Revert if there is nothing to withdraw\\n        if (amount == 0) revert NothingToWithdraw();\\n\\n        IERC20(_token).transfer(_beneficiary, amount);\\n    }\\n}\\n\",\"keccak256\":\"0x24daab9525bd7a1bd68e49ff40016fbf26ccf0bcede1c342d2d86df2ff3aeb1b\",\"license\":\"MIT\"}},\"version\":1}",
  "bytecode": "0x60a06040523480156200001157600080fd5b5060405162001eb338038062001eb38339810160408190526200003491620001ee565b33806000846001600160a01b03811662000069576040516335fdcccd60e21b8152600060048201526024015b60405180910390fd5b6001600160a01b039081166080528216620000c75760405162461bcd60e51b815260206004820152601860248201527f43616e6e6f7420736574206f776e657220746f207a65726f0000000000000000604482015260640162000060565b600080546001600160a01b0319166001600160a01b0384811691909117909155811615620000fa57620000fa8162000126565b5050600980546001600160a01b0319166001600160a01b03939093169290921790915550620002269050565b336001600160a01b03821603620001805760405162461bcd60e51b815260206004820152601760248201527f43616e6e6f74207472616e7366657220746f2073656c66000000000000000000604482015260640162000060565b600180546001600160a01b0319166001600160a01b0383811691821790925560008054604051929316917fed8889f560326eb138920d842192f0eb3dd22b4f139c87a2c57538e05bae12789190a350565b80516001600160a01b0381168114620001e957600080fd5b919050565b600080604083850312156200020257600080fd5b6200020d83620001d1565b91506200021d60208401620001d1565b90509250929050565b608051611c6a620002496000396000818161031e01526109c90152611c6a6000f3fe6080604052600436106101025760003560e01c806379ba50971161009557806396d3b83d1161006457806396d3b83d146102ef578063b0f479a11461030f578063db04fa4914610342578063eab5b02c14610362578063f2fde38b1461038257600080fd5b806379ba50971461026857806385572ffb1461027d5780638da5cb5b1461029d5780638f3f4e1a146102cf57600080fd5b80634030d521116100d15780634030d521146101b857806351cff8d9146101e85780636159ada11461020857806375c67c661461023857600080fd5b806301ffc9a71461010e5780631dd11dac14610143578063263596a5146101715780633aeac4e11461019657600080fd5b3661010957005b600080fd5b34801561011a57600080fd5b5061012e610129366004611373565b6103a2565b60405190151581526020015b60405180910390f35b34801561014f57600080fd5b5061016361015e3660046113d5565b6103d9565b60405190815260200161013a565b34801561017d57600080fd5b5061018661068a565b60405161013a94939291906114d7565b3480156101a257600080fd5b506101b66101b136600461150c565b610749565b005b3480156101c457600080fd5b5061012e6101d3366004611545565b60076020526000908152604090205460ff1681565b3480156101f457600080fd5b506101b6610203366004611560565b610858565b34801561021457600080fd5b5061012e610223366004611560565b60086020526000908152604090205460ff1681565b34801561024457600080fd5b5061012e610253366004611545565b60066020526000908152604090205460ff1681565b34801561027457600080fd5b506101b6610914565b34801561028957600080fd5b506101b661029836600461157d565b6109be565b3480156102a957600080fd5b506000546001600160a01b03165b6040516001600160a01b03909116815260200161013a565b3480156102db57600080fd5b506101636102ea3660046113d5565b610a1d565b3480156102fb57600080fd5b506101b661030a3660046115c5565b610e25565b34801561031b57600080fd5b507f00000000000000000000000000000000000000000000000000000000000000006102b7565b34801561034e57600080fd5b506101b661035d3660046115c5565b610e58565b34801561036e57600080fd5b506101b661037d3660046115f1565b610e8b565b34801561038e57600080fd5b506101b661039d366004611560565b610ebe565b60006001600160e01b031982166385572ffb60e01b14806103d357506001600160e01b031982166301ffc9a760e01b145b92915050565b60006103e3610ecf565b6001600160401b038716600090815260066020526040902054879060ff1661042e5760405163206abad760e01b81526001600160401b03821660048201526024015b60405180910390fd5b600061043f88888888886000610f24565b90506000306001600160a01b031663b0f479a16040518163ffffffff1660e01b8152600401602060405180830381865afa158015610481573d6000803e3d6000fd5b505050506040513d601f19601f820116820180604052508101906104a5919061160f565b90506000816001600160a01b03166320487ded8c856040518363ffffffff1660e01b81526004016104d792919061162c565b602060405180830381865afa1580156104f4573d6000803e3d6000fd5b505050506040513d601f19601f820116820180604052508101906105189190611705565b90504781111561054457604051634787a10360e11b815247600482015260248101829052604401610425565b60405163095ea7b360e01b81526001600160a01b0383811660048301526024820188905288169063095ea7b3906044016020604051808303816000875af1158015610593573d6000803e3d6000fd5b505050506040513d601f19601f820116820180604052508101906105b7919061171e565b506040516396f4e9f960e01b81526001600160a01b038316906396f4e9f99083906105e8908f90889060040161162c565b60206040518083038185885af1158015610606573d6000803e3d6000fd5b50505050506040513d601f19601f8201168201806040525081019061062b9190611705565b94508a6001600160401b0316857f437cb3c5ba4364504dda6ba3c906ffb0897c7beeb1675f3aaf22a1b9a99b39948c8c8c8c8c6000896040516106749796959493929190611764565b60405180910390a3505050509695505050505050565b600060606000806002546005600360009054906101000a90046001600160a01b03166004548280546106bb906117ac565b80601f01602080910402602001604051908101604052809291908181526020018280546106e7906117ac565b80156107345780601f1061070957610100808354040283529160200191610734565b820191906000526020600020905b81548152906001019060200180831161071757829003601f168201915b50505050509250935093509350935090919293565b610751610ecf565b6040516370a0823160e01b81523060048201526000906001600160a01b038316906370a0823190602401602060405180830381865afa158015610798573d6000803e3d6000fd5b505050506040513d601f19601f820116820180604052508101906107bc9190611705565b9050806000036107df57604051630686827b60e51b815260040160405180910390fd5b60405163a9059cbb60e01b81526001600160a01b0384811660048301526024820183905283169063a9059cbb906044016020604051808303816000875af115801561082e573d6000803e3d6000fd5b505050506040513d601f19601f82011682018060405250810190610852919061171e565b50505050565b610860610ecf565b47600081900361088357604051630686827b60e51b815260040160405180910390fd5b6000826001600160a01b03168260405160006040518083038185875af1925050503d80600081146108d0576040519150601f19603f3d011682016040523d82523d6000602084013e6108d5565b606091505b505090508061090f57604051639d11f56360e01b81523360048201526001600160a01b038416602482015260448101839052606401610425565b505050565b6001546001600160a01b031633146109675760405162461bcd60e51b815260206004820152601660248201527526bab9ba10313290383937b837b9b2b21037bbb732b960511b6044820152606401610425565b60008054336001600160a01b0319808316821784556001805490911690556040516001600160a01b0390921692909183917f8be0079c531659141344cd1fd0a4f28419497f9722a3daafe3b4186f6b6457e091a350565b336001600160a01b037f00000000000000000000000000000000000000000000000000000000000000001614610a09576040516335fdcccd60e21b8152336004820152602401610425565b610a1a610a158261199f565b6110c0565b50565b6000610a27610ecf565b6001600160401b038716600090815260066020526040902054879060ff16610a6d5760405163206abad760e01b81526001600160401b0382166004820152602401610425565b6000610a928888888888600960009054906101000a90046001600160a01b0316610f24565b90506000306001600160a01b031663b0f479a16040518163ffffffff1660e01b8152600401602060405180830381865afa158015610ad4573d6000803e3d6000fd5b505050506040513d601f19601f82011682018060405250810190610af8919061160f565b90506000816001600160a01b03166320487ded8c856040518363ffffffff1660e01b8152600401610b2a92919061162c565b602060405180830381865afa158015610b47573d6000803e3d6000fd5b505050506040513d601f19601f82011682018060405250810190610b6b9190611705565b6009546040516370a0823160e01b81523060048201529192506001600160a01b0316906370a0823190602401602060405180830381865afa158015610bb4573d6000803e3d6000fd5b505050506040513d601f19601f82011682018060405250810190610bd89190611705565b811115610c6f576009546040516370a0823160e01b81523060048201526001600160a01b03909116906370a0823190602401602060405180830381865afa158015610c27573d6000803e3d6000fd5b505050506040513d601f19601f82011682018060405250810190610c4b9190611705565b604051634787a10360e11b8152600481019190915260248101829052604401610425565b60095460405163095ea7b360e01b81526001600160a01b038481166004830152602482018490529091169063095ea7b3906044016020604051808303816000875af1158015610cc2573d6000803e3d6000fd5b505050506040513d601f19601f82011682018060405250810190610ce6919061171e565b5060405163095ea7b360e01b81526001600160a01b0383811660048301526024820188905288169063095ea7b3906044016020604051808303816000875af1158015610d36573d6000803e3d6000fd5b505050506040513d601f19601f82011682018060405250810190610d5a919061171e565b506040516396f4e9f960e01b81526001600160a01b038316906396f4e9f990610d89908e90879060040161162c565b6020604051808303816000875af1158015610da8573d6000803e3d6000fd5b505050506040513d601f19601f82011682018060405250810190610dcc9190611705565b6009546040519196506001600160401b038d169187917f437cb3c5ba4364504dda6ba3c906ffb0897c7beeb1675f3aaf22a1b9a99b399491610674918f918f918f918f918f916001600160a01b03909116908b90611764565b610e2d610ecf565b6001600160401b03919091166000908152600660205260409020805460ff1916911515919091179055565b610e60610ecf565b6001600160401b03919091166000908152600760205260409020805460ff1916911515919091179055565b610e93610ecf565b6001600160a01b03919091166000908152600860205260409020805460ff1916911515919091179055565b610ec6610ecf565b610a1a816112ca565b6000546001600160a01b03163314610f225760405162461bcd60e51b815260206004820152601660248201527527b7363c9031b0b63630b1363290313c9037bbb732b960511b6044820152606401610425565b565b610f5f6040518060a0016040528060608152602001606081526020016060815260200160006001600160a01b03168152602001606081525090565b604080516001808252818301909252600091816020015b6040805180820190915260008082526020820152815260200190600190039081610f765790505090506040518060400160405280866001600160a01b031681526020018581525081600081518110610fd057610fd0611a4b565b60209081029190910101526040805160a081019091526001600160a01b03891660c08201528060e0810160405160208183030381529060405281526020018888604051602001611021929190611a61565b6040516020818303038152906040528152602001828152602001846001600160a01b031681526020016110b2604051806040016040528062030d408152602001600015158152506040805182516024820152602092830151151560448083019190915282518083039091018152606490910190915290810180516001600160e01b03166397a657c960e01b17905290565b905298975050505050505050565b806020015181604001518060200190518101906110dd919061160f565b6001600160401b03821660009081526007602052604090205460ff166111215760405163042784cf60e31b81526001600160401b0383166004820152602401610425565b6001600160a01b03811660009081526008602052604090205460ff16611165576040516368692cbb60e11b81526001600160a01b0382166004820152602401610425565b82516002556060830151805161118391602091810182019101611a7d565b6005906111909082611b41565b5082608001516000815181106111a8576111a8611a4b565b602002602001015160000151600360006101000a8154816001600160a01b0302191690836001600160a01b0316021790555082608001516000815181106111f1576111f1611a4b565b60200260200101516020015160048190555082602001516001600160401b031683600001517f90ec910a8f80bb04e184a806e2ae6f8786ef2ae898859a3180f953397edc1201856040015180602001905181019061124f919061160f565b86606001518060200190518101906112679190611a7d565b876080015160008151811061127e5761127e611a4b565b60200260200101516000015188608001516000815181106112a1576112a1611a4b565b6020026020010151602001516040516112bd9493929190611c00565b60405180910390a3505050565b336001600160a01b038216036113225760405162461bcd60e51b815260206004820152601760248201527f43616e6e6f74207472616e7366657220746f2073656c660000000000000000006044820152606401610425565b600180546001600160a01b0319166001600160a01b0383811691821790925560008054604051929316917fed8889f560326eb138920d842192f0eb3dd22b4f139c87a2c57538e05bae12789190a350565b60006020828403121561138557600080fd5b81356001600160e01b03198116811461139d57600080fd5b9392505050565b80356001600160401b03811681146113bb57600080fd5b919050565b6001600160a01b0381168114610a1a57600080fd5b60008060008060008060a087890312156113ee57600080fd5b6113f7876113a4565b95506020870135611407816113c0565b945060408701356001600160401b038082111561142357600080fd5b818901915089601f83011261143757600080fd5b81358181111561144657600080fd5b8a602082850101111561145857600080fd5b6020830196508095505050506060870135611472816113c0565b80925050608087013590509295509295509295565b60005b838110156114a257818101518382015260200161148a565b50506000910152565b600081518084526114c3816020860160208601611487565b601f01601f19169290920160200192915050565b8481526080602082015260006114f060808301866114ab565b6001600160a01b03949094166040830152506060015292915050565b6000806040838503121561151f57600080fd5b823561152a816113c0565b9150602083013561153a816113c0565b809150509250929050565b60006020828403121561155757600080fd5b61139d826113a4565b60006020828403121561157257600080fd5b813561139d816113c0565b60006020828403121561158f57600080fd5b81356001600160401b038111156115a557600080fd5b820160a0818503121561139d57600080fd5b8015158114610a1a57600080fd5b600080604083850312156115d857600080fd5b6115e1836113a4565b9150602083013561153a816115b7565b6000806040838503121561160457600080fd5b82356115e1816113c0565b60006020828403121561162157600080fd5b815161139d816113c0565b600060406001600160401b038516835260208181850152845160a08386015261165860e08601826114ab565b905081860151603f198087840301606088015261167583836114ab565b88860151888203830160808a01528051808352908601945060009350908501905b808410156116c857845180516001600160a01b0316835286015186830152938501936001939093019290860190611696565b5060608901516001600160a01b031660a08901526080890151888203830160c08a015295506116f781876114ab565b9a9950505050505050505050565b60006020828403121561171757600080fd5b5051919050565b60006020828403121561173057600080fd5b815161139d816115b7565b81835281816020850137506000828201602090810191909152601f909101601f19169091010190565b600060018060a01b03808a16835260c0602084015261178760c08401898b61173b565b968116604084015260608301959095525091909216608082015260a001529392505050565b600181811c908216806117c057607f821691505b6020821081036117e057634e487b7160e01b600052602260045260246000fd5b50919050565b634e487b7160e01b600052604160045260246000fd5b604080519081016001600160401b038111828210171561181e5761181e6117e6565b60405290565b60405160a081016001600160401b038111828210171561181e5761181e6117e6565b604051601f8201601f191681016001600160401b038111828210171561186e5761186e6117e6565b604052919050565b60006001600160401b0382111561188f5761188f6117e6565b50601f01601f191660200190565b600082601f8301126118ae57600080fd5b81356118c16118bc82611876565b611846565b8181528460208386010111156118d657600080fd5b816020850160208301376000918101602001919091529392505050565b600082601f83011261190457600080fd5b813560206001600160401b0382111561191f5761191f6117e6565b61192d818360051b01611846565b82815260069290921b8401810191818101908684111561194c57600080fd5b8286015b8481101561199457604081890312156119695760008081fd5b6119716117fc565b813561197c816113c0565b81528185013585820152835291830191604001611950565b509695505050505050565b600060a082360312156119b157600080fd5b6119b9611824565b823581526119c9602084016113a4565b602082015260408301356001600160401b03808211156119e857600080fd5b6119f43683870161189d565b60408401526060850135915080821115611a0d57600080fd5b611a193683870161189d565b60608401526080850135915080821115611a3257600080fd5b50611a3f368286016118f3565b60808301525092915050565b634e487b7160e01b600052603260045260246000fd5b602081526000611a7560208301848661173b565b949350505050565b600060208284031215611a8f57600080fd5b81516001600160401b03811115611aa557600080fd5b8201601f81018413611ab657600080fd5b8051611ac46118bc82611876565b818152856020838501011115611ad957600080fd5b611aea826020830160208601611487565b95945050505050565b601f82111561090f57600081815260208120601f850160051c81016020861015611b1a5750805b601f850160051c820191505b81811015611b3957828155600101611b26565b505050505050565b81516001600160401b03811115611b5a57611b5a6117e6565b611b6e81611b6884546117ac565b84611af3565b602080601f831160018114611ba35760008415611b8b5750858301515b600019600386901b1c1916600185901b178555611b39565b600085815260208120601f198616915b82811015611bd257888601518255948401946001909101908401611bb3565b5085821015611bf05787850151600019600388901b60f8161c191681555b5050505050600190811b01905550565b600060018060a01b03808716835260806020840152611c2260808401876114ab565b9416604083015250606001529291505056fea2646970667358221220f10b77c5ab4067fda35513fbfcd5cd4010266b33be95882b17f3c60bd53c0b1864736f6c63430008130033",
  "deployedBytecode": "0x6080604052600436106101025760003560e01c806379ba50971161009557806396d3b83d1161006457806396d3b83d146102ef578063b0f479a11461030f578063db04fa4914610342578063eab5b02c14610362578063f2fde38b1461038257600080fd5b806379ba50971461026857806385572ffb1461027d5780638da5cb5b1461029d5780638f3f4e1a146102cf57600080fd5b80634030d521116100d15780634030d521146101b857806351cff8d9146101e85780636159ada11461020857806375c67c661461023857600080fd5b806301ffc9a71461010e5780631dd11dac14610143578063263596a5146101715780633aeac4e11461019657600080fd5b3661010957005b600080fd5b34801561011a57600080fd5b5061012e610129366004611373565b6103a2565b60405190151581526020015b60405180910390f35b34801561014f57600080fd5b5061016361015e3660046113d5565b6103d9565b60405190815260200161013a565b34801561017d57600080fd5b5061018661068a565b60405161013a94939291906114d7565b3480156101a257600080fd5b506101b66101b136600461150c565b610749565b005b3480156101c457600080fd5b5061012e6101d3366004611545565b60076020526000908152604090205460ff1681565b3480156101f457600080fd5b506101b6610203366004611560565b610858565b34801561021457600080fd5b5061012e610223366004611560565b60086020526000908152604090205460ff1681565b34801561024457600080fd5b5061012e610253366004611545565b60066020526000908152604090205460ff1681565b34801561027457600080fd5b506101b6610914565b34801561028957600080fd5b506101b661029836600461157d565b6109be565b3480156102a957600080fd5b506000546001600160a01b03165b6040516001600160a01b03909116815260200161013a565b3480156102db57600080fd5b506101636102ea3660046113d5565b610a1d565b3480156102fb57600080fd5b506101b661030a3660046115c5565b610e25565b34801561031b57600080fd5b507f00000000000000000000000000000000000000000000000000000000000000006102b7565b34801561034e57600080fd5b506101b661035d3660046115c5565b610e58565b34801561036e57600080fd5b506101b661037d3660046115f1565b610e8b565b34801561038e57600080fd5b506101b661039d366004611560565b610ebe565b60006001600160e01b031982166385572ffb60e01b14806103d357506001600160e01b031982166301ffc9a760e01b145b92915050565b60006103e3610ecf565b6001600160401b038716600090815260066020526040902054879060ff1661042e5760405163206abad760e01b81526001600160401b03821660048201526024015b60405180910390fd5b600061043f88888888886000610f24565b90506000306001600160a01b031663b0f479a16040518163ffffffff1660e01b8152600401602060405180830381865afa158015610481573d6000803e3d6000fd5b505050506040513d601f19601f820116820180604052508101906104a5919061160f565b90506000816001600160a01b03166320487ded8c856040518363ffffffff1660e01b81526004016104d792919061162c565b602060405180830381865afa1580156104f4573d6000803e3d6000fd5b505050506040513d601f19601f820116820180604052508101906105189190611705565b90504781111561054457604051634787a10360e11b815247600482015260248101829052604401610425565b60405163095ea7b360e01b81526001600160a01b0383811660048301526024820188905288169063095ea7b3906044016020604051808303816000875af1158015610593573d6000803e3d6000fd5b505050506040513d601f19601f820116820180604052508101906105b7919061171e565b506040516396f4e9f960e01b81526001600160a01b038316906396f4e9f99083906105e8908f90889060040161162c565b60206040518083038185885af1158015610606573d6000803e3d6000fd5b50505050506040513d601f19601f8201168201806040525081019061062b9190611705565b94508a6001600160401b0316857f437cb3c5ba4364504dda6ba3c906ffb0897c7beeb1675f3aaf22a1b9a99b39948c8c8c8c8c6000896040516106749796959493929190611764565b60405180910390a3505050509695505050505050565b600060606000806002546005600360009054906101000a90046001600160a01b03166004548280546106bb906117ac565b80601f01602080910402602001604051908101604052809291908181526020018280546106e7906117ac565b80156107345780601f1061070957610100808354040283529160200191610734565b820191906000526020600020905b81548152906001019060200180831161071757829003601f168201915b50505050509250935093509350935090919293565b610751610ecf565b6040516370a0823160e01b81523060048201526000906001600160a01b038316906370a0823190602401602060405180830381865afa158015610798573d6000803e3d6000fd5b505050506040513d601f19601f820116820180604052508101906107bc9190611705565b9050806000036107df57604051630686827b60e51b815260040160405180910390fd5b60405163a9059cbb60e01b81526001600160a01b0384811660048301526024820183905283169063a9059cbb906044016020604051808303816000875af115801561082e573d6000803e3d6000fd5b505050506040513d601f19601f82011682018060405250810190610852919061171e565b50505050565b610860610ecf565b47600081900361088357604051630686827b60e51b815260040160405180910390fd5b6000826001600160a01b03168260405160006040518083038185875af1925050503d80600081146108d0576040519150601f19603f3d011682016040523d82523d6000602084013e6108d5565b606091505b505090508061090f57604051639d11f56360e01b81523360048201526001600160a01b038416602482015260448101839052606401610425565b505050565b6001546001600160a01b031633146109675760405162461bcd60e51b815260206004820152601660248201527526bab9ba10313290383937b837b9b2b21037bbb732b960511b6044820152606401610425565b60008054336001600160a01b0319808316821784556001805490911690556040516001600160a01b0390921692909183917f8be0079c531659141344cd1fd0a4f28419497f9722a3daafe3b4186f6b6457e091a350565b336001600160a01b037f00000000000000000000000000000000000000000000000000000000000000001614610a09576040516335fdcccd60e21b8152336004820152602401610425565b610a1a610a158261199f565b6110c0565b50565b6000610a27610ecf565b6001600160401b038716600090815260066020526040902054879060ff16610a6d5760405163206abad760e01b81526001600160401b0382166004820152602401610425565b6000610a928888888888600960009054906101000a90046001600160a01b0316610f24565b90506000306001600160a01b031663b0f479a16040518163ffffffff1660e01b8152600401602060405180830381865afa158015610ad4573d6000803e3d6000fd5b505050506040513d601f19601f82011682018060405250810190610af8919061160f565b90506000816001600160a01b03166320487ded8c856040518363ffffffff1660e01b8152600401610b2a92919061162c565b602060405180830381865afa158015610b47573d6000803e3d6000fd5b505050506040513d601f19601f82011682018060405250810190610b6b9190611705565b6009546040516370a0823160e01b81523060048201529192506001600160a01b0316906370a0823190602401602060405180830381865afa158015610bb4573d6000803e3d6000fd5b505050506040513d601f19601f82011682018060405250810190610bd89190611705565b811115610c6f576009546040516370a0823160e01b81523060048201526001600160a01b03909116906370a0823190602401602060405180830381865afa158015610c27573d6000803e3d6000fd5b505050506040513d601f19601f82011682018060405250810190610c4b9190611705565b604051634787a10360e11b8152600481019190915260248101829052604401610425565b60095460405163095ea7b360e01b81526001600160a01b038481166004830152602482018490529091169063095ea7b3906044016020604051808303816000875af1158015610cc2573d6000803e3d6000fd5b505050506040513d601f19601f82011682018060405250810190610ce6919061171e565b5060405163095ea7b360e01b81526001600160a01b0383811660048301526024820188905288169063095ea7b3906044016020604051808303816000875af1158015610d36573d6000803e3d6000fd5b505050506040513d601f19601f82011682018060405250810190610d5a919061171e565b506040516396f4e9f960e01b81526001600160a01b038316906396f4e9f990610d89908e90879060040161162c565b6020604051808303816000875af1158015610da8573d6000803e3d6000fd5b505050506040513d601f19601f82011682018060405250810190610dcc9190611705565b6009546040519196506001600160401b038d169187917f437cb3c5ba4364504dda6ba3c906ffb0897c7beeb1675f3aaf22a1b9a99b399491610674918f918f918f918f918f916001600160a01b03909116908b90611764565b610e2d610ecf565b6001600160401b03919091166000908152600660205260409020805460ff1916911515919091179055565b610e60610ecf565b6001600160401b03919091166000908152600760205260409020805460ff1916911515919091179055565b610e93610ecf565b6001600160a01b03919091166000908152600860205260409020805460ff1916911515919091179055565b610ec6610ecf565b610a1a816112ca565b6000546001600160a01b03163314610f225760405162461bcd60e51b815260206004820152601660248201527527b7363c9031b0b63630b1363290313c9037bbb732b960511b6044820152606401610425565b565b610f5f6040518060a0016040528060608152602001606081526020016060815260200160006001600160a01b03168152602001606081525090565b604080516001808252818301909252600091816020015b6040805180820190915260008082526020820152815260200190600190039081610f765790505090506040518060400160405280866001600160a01b031681526020018581525081600081518110610fd057610fd0611a4b565b60209081029190910101526040805160a081019091526001600160a01b03891660c08201528060e0810160405160208183030381529060405281526020018888604051602001611021929190611a61565b6040516020818303038152906040528152602001828152602001846001600160a01b031681526020016110b2604051806040016040528062030d408152602001600015158152506040805182516024820152602092830151151560448083019190915282518083039091018152606490910190915290810180516001600160e01b03166397a657c960e01b17905290565b905298975050505050505050565b806020015181604001518060200190518101906110dd919061160f565b6001600160401b03821660009081526007602052604090205460ff166111215760405163042784cf60e31b81526001600160401b0383166004820152602401610425565b6001600160a01b03811660009081526008602052604090205460ff16611165576040516368692cbb60e11b81526001600160a01b0382166004820152602401610425565b82516002556060830151805161118391602091810182019101611a7d565b6005906111909082611b41565b5082608001516000815181106111a8576111a8611a4b565b602002602001015160000151600360006101000a8154816001600160a01b0302191690836001600160a01b0316021790555082608001516000815181106111f1576111f1611a4b565b60200260200101516020015160048190555082602001516001600160401b031683600001517f90ec910a8f80bb04e184a806e2ae6f8786ef2ae898859a3180f953397edc1201856040015180602001905181019061124f919061160f565b86606001518060200190518101906112679190611a7d565b876080015160008151811061127e5761127e611a4b565b60200260200101516000015188608001516000815181106112a1576112a1611a4b565b6020026020010151602001516040516112bd9493929190611c00565b60405180910390a3505050565b336001600160a01b038216036113225760405162461bcd60e51b815260206004820152601760248201527f43616e6e6f74207472616e7366657220746f2073656c660000000000000000006044820152606401610425565b600180546001600160a01b0319166001600160a01b0383811691821790925560008054604051929316917fed8889f560326eb138920d842192f0eb3dd22b4f139c87a2c57538e05bae12789190a350565b60006020828403121561138557600080fd5b81356001600160e01b03198116811461139d57600080fd5b9392505050565b80356001600160401b03811681146113bb57600080fd5b919050565b6001600160a01b0381168114610a1a57600080fd5b60008060008060008060a087890312156113ee57600080fd5b6113f7876113a4565b95506020870135611407816113c0565b945060408701356001600160401b038082111561142357600080fd5b818901915089601f83011261143757600080fd5b81358181111561144657600080fd5b8a602082850101111561145857600080fd5b6020830196508095505050506060870135611472816113c0565b80925050608087013590509295509295509295565b60005b838110156114a257818101518382015260200161148a565b50506000910152565b600081518084526114c3816020860160208601611487565b601f01601f19169290920160200192915050565b8481526080602082015260006114f060808301866114ab565b6001600160a01b03949094166040830152506060015292915050565b6000806040838503121561151f57600080fd5b823561152a816113c0565b9150602083013561153a816113c0565b809150509250929050565b60006020828403121561155757600080fd5b61139d826113a4565b60006020828403121561157257600080fd5b813561139d816113c0565b60006020828403121561158f57600080fd5b81356001600160401b038111156115a557600080fd5b820160a0818503121561139d57600080fd5b8015158114610a1a57600080fd5b600080604083850312156115d857600080fd5b6115e1836113a4565b9150602083013561153a816115b7565b6000806040838503121561160457600080fd5b82356115e1816113c0565b60006020828403121561162157600080fd5b815161139d816113c0565b600060406001600160401b038516835260208181850152845160a08386015261165860e08601826114ab565b905081860151603f198087840301606088015261167583836114ab565b88860151888203830160808a01528051808352908601945060009350908501905b808410156116c857845180516001600160a01b0316835286015186830152938501936001939093019290860190611696565b5060608901516001600160a01b031660a08901526080890151888203830160c08a015295506116f781876114ab565b9a9950505050505050505050565b60006020828403121561171757600080fd5b5051919050565b60006020828403121561173057600080fd5b815161139d816115b7565b81835281816020850137506000828201602090810191909152601f909101601f19169091010190565b600060018060a01b03808a16835260c0602084015261178760c08401898b61173b565b968116604084015260608301959095525091909216608082015260a001529392505050565b600181811c908216806117c057607f821691505b6020821081036117e057634e487b7160e01b600052602260045260246000fd5b50919050565b634e487b7160e01b600052604160045260246000fd5b604080519081016001600160401b038111828210171561181e5761181e6117e6565b60405290565b60405160a081016001600160401b038111828210171561181e5761181e6117e6565b604051601f8201601f191681016001600160401b038111828210171561186e5761186e6117e6565b604052919050565b60006001600160401b0382111561188f5761188f6117e6565b50601f01601f191660200190565b600082601f8301126118ae57600080fd5b81356118c16118bc82611876565b611846565b8181528460208386010111156118d657600080fd5b816020850160208301376000918101602001919091529392505050565b600082601f83011261190457600080fd5b813560206001600160401b0382111561191f5761191f6117e6565b61192d818360051b01611846565b82815260069290921b8401810191818101908684111561194c57600080fd5b8286015b8481101561199457604081890312156119695760008081fd5b6119716117fc565b813561197c816113c0565b81528185013585820152835291830191604001611950565b509695505050505050565b600060a082360312156119b157600080fd5b6119b9611824565b823581526119c9602084016113a4565b602082015260408301356001600160401b03808211156119e857600080fd5b6119f43683870161189d565b60408401526060850135915080821115611a0d57600080fd5b611a193683870161189d565b60608401526080850135915080821115611a3257600080fd5b50611a3f368286016118f3565b60808301525092915050565b634e487b7160e01b600052603260045260246000fd5b602081526000611a7560208301848661173b565b949350505050565b600060208284031215611a8f57600080fd5b81516001600160401b03811115611aa557600080fd5b8201601f81018413611ab657600080fd5b8051611ac46118bc82611876565b818152856020838501011115611ad957600080fd5b611aea826020830160208601611487565b95945050505050565b601f82111561090f57600081815260208120601f850160051c81016020861015611b1a5750805b601f850160051c820191505b81811015611b3957828155600101611b26565b505050505050565b81516001600160401b03811115611b5a57611b5a6117e6565b611b6e81611b6884546117ac565b84611af3565b602080601f831160018114611ba35760008415611b8b5750858301515b600019600386901b1c1916600185901b178555611b39565b600085815260208120601f198616915b82811015611bd257888601518255948401946001909101908401611bb3565b5085821015611bf05787850151600019600388901b60f8161c191681555b5050505050600190811b01905550565b600060018060a01b03808716835260806020840152611c2260808401876114ab565b9416604083015250606001529291505056fea2646970667358221220f10b77c5ab4067fda35513fbfcd5cd4010266b33be95882b17f3c60bd53c0b1864736f6c63430008130033",
  "devdoc": {
    "kind": "dev",
    "methods": {
      "allowlistDestinationChain(uint64,bool)": {
        "details": "Updates the allowlist status of a destination chain for transactions.",
        "params": {
          "_destinationChainSelector": "The selector of the destination chain to be updated.",
          "allowed": "The allowlist status to be set for the destination chain."
        }
      },
      "allowlistSender(address,bool)": {
        "details": "Updates the allowlist status of a sender for transactions.",
        "params": {
          "_sender": "The address of the sender to be updated.",
          "allowed": "The allowlist status to be set for the sender."
        }
      },
      "allowlistSourceChain(uint64,bool)": {
        "details": "Updates the allowlist status of a source chain",
        "params": {
          "_sourceChainSelector": "The selector of the source chain to be updated.",
          "allowed": "The allowlist status to be set for the source chain."
        }
      },
      "ccipReceive((bytes32,uint64,bytes,bytes,(address,uint256)[]))": {
        "details": "Note ensure you check the msg.sender is the OffRampRouter",
        "params": {
          "message": "CCIP Message"
        }
      },
      "constructor": {
        "params": {
          "_link": "The address of the link contract.",
          "_router": "The address of the router contract."
        }
      },
      "getLastReceivedMessageDetails()": {
        "details": "This function retrieves the ID, text, token address, and token amount of the last received CCIP message.",
        "returns": {
          "messageId": "The ID of the last received CCIP message.",
          "text": "The text of the last received CCIP message.",
          "tokenAddress": "The address of the token in the last CCIP received message.",
          "tokenAmount": "The amount of the token in the last CCIP received message."
        }
      },
      "getRouter()": {
        "returns": {
          "_0": "i_router address"
        }
      },
      "sendMessagePayLINK(uint64,address,string,address,uint256)": {
        "details": "Assumes your contract has sufficient LINK to pay for CCIP fees.",
        "params": {
          "_amount": "token amount.",
          "_destinationChainSelector": "The identifier (aka selector) for the destination blockchain.",
          "_receiver": "The address of the recipient on the destination blockchain.",
          "_text": "The string data to be sent.",
          "_token": "token address."
        },
        "returns": {
          "messageId": "The ID of the CCIP message that was sent."
        }
      },
      "sendMessagePayNative(uint64,address,string,address,uint256)": {
        "details": "Assumes your contract has sufficient native gas like ETH on Ethereum or MATIC on Polygon.",
        "params": {
          "_amount": "token amount.",
          "_destinationChainSelector": "The identifier (aka selector) for the destination blockchain.",
          "_receiver": "The address of the recipient on the destination blockchain.",
          "_text": "The string data to be sent.",
          "_token": "token address."
        },
        "returns": {
          "messageId": "The ID of the CCIP message that was sent."
        }
      },
      "supportsInterface(bytes4)": {
        "params": {
          "interfaceId": "The interfaceId to check"
        },
        "returns": {
          "_0": "true if the interfaceId is supported"
        }
      },
      "withdraw(address)": {
        "details": "This function reverts if there are no funds to withdraw or if the transfer fails. It should only be callable by the owner of the contract.",
        "params": {
          "_beneficiary": "The address to which the Ether should be sent."
        }
      },
      "withdrawToken(address,address)": {
        "details": "This function reverts with a 'NothingToWithdraw' error if there are no tokens to withdraw.",
        "params": {
          "_beneficiary": "The address to which the tokens will be sent.",
          "_token": "The contract address of the ERC20 token to be withdrawn."
        }
      }
    },
    "title": "- A simple messenger contract for transferring/receiving tokens and data across chains.",
    "version": 1
  },
  "userdoc": {
    "kind": "user",
    "methods": {
      "acceptOwnership()": {
        "notice": "Allows an ownership transfer to be completed by the recipient."
      },
      "allowlistDestinationChain(uint64,bool)": {
        "notice": "This function can only be called by the owner."
      },
      "allowlistSender(address,bool)": {
        "notice": "This function can only be called by the owner."
      },
      "allowlistSourceChain(uint64,bool)": {
        "notice": "This function can only be called by the owner."
      },
      "ccipReceive((bytes32,uint64,bytes,bytes,(address,uint256)[]))": {
        "notice": "Called by the Router to deliver a message. If this reverts, any token transfers also revert. The message will move to a FAILED state and become available for manual execution."
      },
      "constructor": {
        "notice": "Constructor initializes the contract with the router address."
      },
      "getLastReceivedMessageDetails()": {
        "notice": "Returns the details of the last CCIP received message."
      },
      "getRouter()": {
        "notice": "Return the current router"
      },
      "owner()": {
        "notice": "Get the current owner"
      },
      "sendMessagePayLINK(uint64,address,string,address,uint256)": {
        "notice": "Sends data and transfer tokens to receiver on the destination chain.Pay for fees in LINK."
      },
      "sendMessagePayNative(uint64,address,string,address,uint256)": {
        "notice": "Sends data and transfer tokens to receiver on the destination chain.Pay for fees in native gas."
      },
      "supportsInterface(bytes4)": {
        "notice": "IERC165 supports an interfaceId"
      },
      "transferOwnership(address)": {
        "notice": "Allows an owner to begin transferring ownership to a new address, pending."
      },
      "withdraw(address)": {
        "notice": "Allows the contract owner to withdraw the entire balance of Ether from the contract."
      },
      "withdrawToken(address,address)": {
        "notice": "Allows the owner of the contract to withdraw all tokens of a specific ERC20 token."
      }
    },
    "version": 1
  },
  "storageLayout": {
    "storage": [
      {
        "astId": 27,
        "contract": "contracts/CCIP/ProgrammableTokenTransfers.sol:ProgrammableTokenTransfers",
        "label": "s_owner",
        "offset": 0,
        "slot": "0",
        "type": "t_address"
      },
      {
        "astId": 29,
        "contract": "contracts/CCIP/ProgrammableTokenTransfers.sol:ProgrammableTokenTransfers",
        "label": "s_pendingOwner",
        "offset": 0,
        "slot": "1",
        "type": "t_address"
      },
      {
        "astId": 2437,
        "contract": "contracts/CCIP/ProgrammableTokenTransfers.sol:ProgrammableTokenTransfers",
        "label": "s_lastReceivedMessageId",
        "offset": 0,
        "slot": "2",
        "type": "t_bytes32"
      },
      {
        "astId": 2439,
        "contract": "contracts/CCIP/ProgrammableTokenTransfers.sol:ProgrammableTokenTransfers",
        "label": "s_lastReceivedTokenAddress",
        "offset": 0,
        "slot": "3",
        "type": "t_address"
      },
      {
        "astId": 2441,
        "contract": "contracts/CCIP/ProgrammableTokenTransfers.sol:ProgrammableTokenTransfers",
        "label": "s_lastReceivedTokenAmount",
        "offset": 0,
        "slot": "4",
        "type": "t_uint256"
      },
      {
        "astId": 2443,
        "contract": "contracts/CCIP/ProgrammableTokenTransfers.sol:ProgrammableTokenTransfers",
        "label": "s_lastReceivedText",
        "offset": 0,
        "slot": "5",
        "type": "t_string_storage"
      },
      {
        "astId": 2447,
        "contract": "contracts/CCIP/ProgrammableTokenTransfers.sol:ProgrammableTokenTransfers",
        "label": "allowlistedDestinationChains",
        "offset": 0,
        "slot": "6",
        "type": "t_mapping(t_uint64,t_bool)"
      },
      {
        "astId": 2451,
        "contract": "contracts/CCIP/ProgrammableTokenTransfers.sol:ProgrammableTokenTransfers",
        "label": "allowlistedSourceChains",
        "offset": 0,
        "slot": "7",
        "type": "t_mapping(t_uint64,t_bool)"
      },
      {
        "astId": 2455,
        "contract": "contracts/CCIP/ProgrammableTokenTransfers.sol:ProgrammableTokenTransfers",
        "label": "allowlistedSenders",
        "offset": 0,
        "slot": "8",
        "type": "t_mapping(t_address,t_bool)"
      },
      {
        "astId": 2458,
        "contract": "contracts/CCIP/ProgrammableTokenTransfers.sol:ProgrammableTokenTransfers",
        "label": "s_linkToken",
        "offset": 0,
        "slot": "9",
        "type": "t_contract(IERC20)533"
      }
    ],
    "types": {
      "t_address": {
        "encoding": "inplace",
        "label": "address",
        "numberOfBytes": "20"
      },
      "t_bool": {
        "encoding": "inplace",
        "label": "bool",
        "numberOfBytes": "1"
      },
      "t_bytes32": {
        "encoding": "inplace",
        "label": "bytes32",
        "numberOfBytes": "32"
      },
      "t_contract(IERC20)533": {
        "encoding": "inplace",
        "label": "contract IERC20",
        "numberOfBytes": "20"
      },
      "t_mapping(t_address,t_bool)": {
        "encoding": "mapping",
        "key": "t_address",
        "label": "mapping(address => bool)",
        "numberOfBytes": "32",
        "value": "t_bool"
      },
      "t_mapping(t_uint64,t_bool)": {
        "encoding": "mapping",
        "key": "t_uint64",
        "label": "mapping(uint64 => bool)",
        "numberOfBytes": "32",
        "value": "t_bool"
      },
      "t_string_storage": {
        "encoding": "bytes",
        "label": "string",
        "numberOfBytes": "32"
      },
      "t_uint256": {
        "encoding": "inplace",
        "label": "uint256",
        "numberOfBytes": "32"
      },
      "t_uint64": {
        "encoding": "inplace",
        "label": "uint64",
        "numberOfBytes": "8"
      }
    }
  }
}